Title,Decision,Decision_Date
"Bevacizumab with carboplatin, gemcitabine and paclitaxel for treating the first recurrence of platinum-sensitive advanced ovarian cancer (terminated appraisal)",Rejected,2019-02-20
Regorafenib for previously treated advanced hepatocellular carcinoma,Conditional,2019-01-09
Darvadstrocel for treating complex perianal fistulas in Crohn’s disease,Rejected,2019-01-09
Lenvatinib for untreated advanced hepatocellular carcinoma,Conditional,2018-12-19
Liposomal cytarabine–daunorubicin for untreated acute myeloid leukaemia,Conditional,2018-12-19
Vandetanib for treating medullary thyroid cancer,Rejected,2018-12-12
Decitabine for untreated acute myeloid leukaemia (terminated appraisal),Rejected,2018-12-05
Denosumab for preventing skeletal-related events in multiple myeloma (terminated appraisal),Rejected,2018-12-05
Tofacitinib for moderately to severely active ulcerative colitis,Conditional,2018-11-28
Padeliporfin for untreated localised prostate cancer,Rejected,2018-11-21
Gemtuzumab ozogamicin for untreated acute myeloid leukaemia,Conditional,2018-11-14
Eltrombopag for treating chronic immune thrombocytopenia,Conditional,2013-07-24
Romiplostim for the treatment of chronic immune thrombocytopenia,Conditional,2011-04-27
Dabrafenib with trametinib for adjuvant treatment of resected BRAF V600 mutation-positive melanoma,Conditional,2018-10-17
Tofacitinib for treating active psoriatic arthritis after inadequate response to DMARDs,Conditional,2018-10-03
Cabozantinib for untreated advanced renal cell carcinoma,Conditional,2018-10-03
Inotuzumab ozogamicin for treating relapsed or refractory B-cell acute lymphoblastic leukaemia,Conditional,2018-09-19
Lutetium (177Lu) oxodotreotide for treating unresectable or metastatic neuroendocrine tumours,Conditional,2018-08-29
Dinutuximab beta for treating neuroblastoma,Conditional,2018-08-22
Lenvatinib and sorafenib for treating differentiated thyroid cancer after radioactive iodine,Conditional,2018-08-08
Alectinib for untreated ALK-positive advanced non-small-cell lung cancer,Conditional,2018-08-08
Ixekizumab for treating active psoriatic arthritis after inadequate response to DMARDs,Conditional,2018-08-08
Dupilumab for treating moderate to severe atopic dermatitis,Conditional,2018-08-01
Ocrelizumab for treating relapsing–remitting multiple sclerosis,Conditional,2018-07-25
Pembrolizumab for untreated PD-L1-positive metastatic non-small-cell lung cancer,Conditional,2018-07-18
Nivolumab for treating locally advanced unresectable or metastatic urothelial cancer after platinum-containing chemotherapy,Rejected,2018-07-04
Beta interferons and glatiramer acetate for treating multiple sclerosis,Rejected,2018-06-27
"Donepezil, galantamine, rivastigmine and memantine for the treatment of Alzheimer's disease",Approved,2011-03-23
502 Bad Gateway,Rejected,2018-06-13
Midostaurin for untreated acute myeloid leukaemia,Conditional,2018-06-13
Brentuximab vedotin for treating CD30-positive Hodgkin lymphoma,Conditional,2018-06-13
Atezolizumab for treating locally advanced or metastatic urothelial carcinoma after platinum-containing chemotherapy,Conditional,2018-06-13
Arsenic trioxide for treating acute promyelocytic leukaemia,Approved,2018-06-13
Atezolizumab for treating locally advanced or metastatic non-small-cell lung cancer after chemotherapy,Conditional,2018-05-16
Tocilizumab for treating giant cell arteritis,Conditional,2018-04-18
Eribulin for treating locally advanced or metastatic breast cancer after 1 chemotherapy regimen,Rejected,2018-03-28
Cabozantinib for treating medullary thyroid cancer,Conditional,2018-03-28
Brodalumab for treating moderate to severe plaque psoriasis,Conditional,2018-03-21
Tivozanib for treating advanced renal cell carcinoma,Conditional,2018-03-21
Obinutuzumab for untreated advanced follicular lymphoma,Conditional,2018-03-21
Autologous chondrocyte implantation using chondrosphere for treating symptomatic articular cartilage defects of the knee,Conditional,2018-03-07
Pertuzumab with trastuzumab and docetaxel for treating HER2-positive breast cancer,Conditional,2018-03-07
Sofosbuvir–velpatasvir–voxilaprevir for treating chronic hepatitis C,Conditional,2018-02-21
Raloxifene for the primary prevention of osteoporotic fragility fractures in postmenopausal women,Rejected,2008-10-27
Raloxifene and teriparatide for the secondary prevention of osteoporotic fragility fractures in postmenopausal women,Approved,2008-10-27
Pirfenidone for treating idiopathic pulmonary fibrosis,Conditional,2018-02-06
Intrabeam radiotherapy system for adjuvant treatment of early breast cancer,Rejected,2018-01-31
Ibrutinib for treating relapsed or refractory mantle cell lymphoma,Conditional,2018-01-31
Fulvestrant for untreated locally advanced or metastatic oestrogen-receptor positive breast cancer,Rejected,2018-01-31
Lenvatinib with everolimus for previously treated advanced renal cell carcinoma,Conditional,2018-01-24
Glecaprevir–pibrentasvir for treating chronic hepatitis C,Conditional,2018-01-24
Ceritinib for untreated ALK-positive non-small-cell lung cancer,Conditional,2018-01-24
Golimumab for treating non-radiographic axial spondyloarthritis,Conditional,2018-01-10
"Palbociclib with an aromatase inhibitor for previously untreated, hormone receptor-positive, HER2-negative, locally advanced or metastatic breast cancer",Conditional,2017-12-20
"Ribociclib with an aromatase inhibitor for previously untreated, hormone receptor-positive, HER2-negative, locally advanced or metastatic breast cancer",Conditional,2017-12-20
Naltrexone–bupropion for managing overweight and obesity,Rejected,2017-12-12
Vismodegib for treating basal cell carcinoma,Rejected,2017-11-22
Trastuzumab emtansine for treating HER2-positive advanced breast cancer after trastuzumab and a taxane,Conditional,2017-07-19
Regorafenib for previously treated unresectable or metastatic gastrointestinal stromal tumours,Conditional,2017-11-15
Sarilumab for moderate to severe rheumatoid arthritis,Conditional,2017-11-01
Aflibercept for treating choroidal neovascularisation,Conditional,2017-11-01
Tofacitinib for moderate to severe rheumatoid arthritis,Conditional,2017-10-11
Immunosuppressive therapy for kidney transplant in adults,Rejected,2017-10-11
Immunosuppressive therapy for kidney transplant in children and young people,Rejected,2017-10-11
Autologous chondrocyte implantation for treating symptomatic articular cartilage defects of the knee,Conditional,2017-10-04
Brentuximab vedotin for treating relapsed or refractory systemic anaplastic large cell lymphoma,Conditional,2017-10-04
Reslizumab for treating severe eosinophilic asthma,Conditional,2017-10-04
Cetuximab and panitumumab for previously untreated metastatic colorectal cancer,Approved,2017-03-29
Pembrolizumab for advanced melanoma not previously treated with ipilimumab,Approved,2015-11-25
Pembrolizumab for treating PD-L1-positive non-small-cell lung cancer after chemotherapy,Conditional,2017-01-11
Pembrolizumab for treating advanced melanoma after disease progression with ipilimumab,Approved,2015-10-07
Sorafenib for treating advanced hepatocellular carcinoma,Conditional,2017-09-06
Dimethyl fumarate for treating moderate to severe plaque psoriasis,Conditional,2017-09-06
Paclitaxel as albumin-bound nanoparticles with gemcitabine for untreated metastatic pancreatic cancer,Conditional,2017-09-06
Cetuximab for treating recurrent or metastatic squamous cell cancer of the head and neck,Approved,2017-08-31
Methylnaltrexone bromide for treating opioid-induced constipation (terminated appraisal),Rejected,2017-08-23
Idelalisib with ofatumumab for treating chronic lymphocytic leukaemia (terminated appraisal),Rejected,2017-08-23
Holoclar for treating limbal stem cell deficiency after eye burns,Conditional,2017-08-16
Pemetrexed for the maintenance treatment of non-small-cell lung cancer,Approved,2010-06-23
Cabozantinib for previously treated advanced renal cell carcinoma,Conditional,2017-08-09
Baricitinib for moderate to severe rheumatoid arthritis,Conditional,2017-08-09
Adalimumab and dexamethasone for treating non-infectious uveitis,Conditional,2017-07-26
Roflumilast for treating chronic obstructive pulmonary disease,Conditional,2017-07-26
Nivolumab for treating relapsed or refractory classical Hodgkin lymphoma,Approved,2017-07-26
"Adalimumab, etanercept and ustekinumab for treating plaque psoriasis in children and young people",Conditional,2017-07-12
Ustekinumab for moderately to severely active Crohn’s disease after previous treatment,Approved,2017-07-12
Ibrutinib for untreated chronic lymphocytic leukaemia without a 17p deletion or TP53 mutation (terminated appraisal),Rejected,2017-07-05
Bortezomib for treating multiple myeloma after second or subsequent relapse (terminated appraisal),Rejected,2017-07-05
Daratumumab with lenalidomide and dexamethasone for treating relapsed or refractory multiple myeloma (terminated appraisal),Rejected,2017-07-05
Etelcalcetide for treating secondary hyperparathyroidism,Conditional,2017-06-28
Everolimus and sunitinib for treating unresectable or metastatic neuroendocrine tumours in people with progressive disease,Approved,2017-06-28
Blinatumomab for previously treated Philadelphia-chromosome-negative acute lymphoblastic leukaemia,Conditional,2017-06-28
Ponatinib for treating chronic myeloid leukaemia and acute lymphoblastic leukaemia,Conditional,2017-06-28
Afatinib for treating advanced squamous non-small-cell lung cancer after platinum-based chemotherapy (terminated appraisal),Rejected,2017-05-24
Certolizumab pegol and secukinumab for treating active psoriatic arthritis after inadequate response to DMARDs,Conditional,2017-05-24
Pegylated liposomal irinotecan for treating pancreatic cancer after gemcitabine,Rejected,2017-04-26
Ixekizumab for treating moderate to severe plaque psoriasis,Conditional,2017-04-26
Obeticholic acid for treating primary biliary cholangitis,Conditional,2017-04-26
Alectinib for previously treated anaplastic lymphoma kinase-positive advanced non-small-cell lung cancer (terminated appraisal),Rejected,2017-03-29
Panitumumab in combination with chemotherapy for the treatment of metastatic colorectal cancer (terminated appraisal),Rejected,2011-12-14
Bevacizumab for treating EGFR mutation-positive non-small-cell lung cancer (terminated appraisal),Rejected,2017-03-22
Ibrutinib with bendamustine and rituximab for treating relapsed or refractory chronic lymphocytic leukaemia after systemic therapy (terminated appraisal),Rejected,2017-03-22
Elotuzumab for previously treated multiple myeloma (terminated appraisal),Rejected,2017-03-22
Tenofovir alafenamide for treating chronic hepatitis B (terminated appraisal),Rejected,2017-03-22
Ustekinumab for treating active psoriatic arthritis,Rejected,2015-06-04
Ustekinumab for the treatment of adults with moderate to severe psoriasis,Approved,2009-09-23
Everolimus for advanced renal cell carcinoma after previous treatment,Conditional,2017-02-22
Apremilast for treating active psoriatic arthritis,Conditional,2017-02-22
Ibrutinib for previously treated chronic lymphocytic leukaemia and untreated chronic lymphocytic leukaemia with 17p deletion or TP53 mutation,Approved,2017-01-25
Sofosbuvir–velpatasvir for treating chronic hepatitis C,Conditional,2017-01-25
Pomalidomide for multiple myeloma previously treated with lenalidomide and bortezomib,Approved,2017-01-11
Everolimus with exemestane for treating advanced breast cancer after endocrine therapy,Conditional,2016-12-21
Crizotinib for previously treated anaplastic lymphoma kinase-positive advanced non-small-cell lung cancer,Conditional,2016-12-21
Eribulin for treating locally advanced or metastatic breast cancer after 2 or more chemotherapy regimens,Approved,2016-12-21
Pertuzumab for the neoadjuvant treatment of HER2-positive breast cancer,Conditional,2016-12-21
"Dasatinib, nilotinib and high-dose imatinib for treating imatinib-resistant or intolerant chronic myeloid leukaemia",Rejected,2016-12-21
"Dasatinib, nilotinib and imatinib for untreated chronic myeloid leukaemia",Conditional,2016-12-21
Ticagrelor for preventing atherothrombotic events after myocardial infarction,Approved,2016-12-14
Dapagliflozin in combination therapy for treating type 2 diabetes,Rejected,2013-06-26
Nivolumab for previously treated advanced renal cell carcinoma,Approved,2016-11-23
Dapagliflozin in triple therapy for treating type 2 diabetes,Approved,2016-11-23
Apremilast for treating moderate to severe plaque psoriasis,Conditional,2016-11-23
Certolizumab pegol for treating rheumatoid arthritis after inadequate response to a TNF-alpha inhibitor,Conditional,2016-10-26
Elbasvir–grazoprevir for treating chronic hepatitis C,Conditional,2016-10-26
Cobimetinib in combination with vemurafenib for treating unresectable or metastatic BRAF V600 mutation-positive melanoma,Rejected,2016-10-26
Necitumumab for untreated advanced or metastatic squamous non-small-cell lung cancer,Rejected,2016-09-28
Radium-223 dichloride for treating hormone-relapsed prostate cancer with bone metastases,Conditional,2016-09-28
Crizotinib for untreated anaplastic lymphoma kinase-positive advanced non-small-cell lung cancer,Conditional,2016-09-28
Secukinumab for active ankylosing spondylitis after treatment with non-steroidal anti-inflammatory drugs or TNF-alpha inhibitors,Conditional,2016-09-28
Pegaspargase for treating acute lymphoblastic leukaemia,Approved,2016-09-28
Aflibercept for treating visual impairment caused by macular oedema after branch retinal vein occlusion,Conditional,2016-09-28
Talimogene laherparepvec for treating unresectable metastatic melanoma,Conditional,2016-09-28
Bosutinib for previously treated chronic myeloid leukaemia,Approved,2016-08-24
Pemetrexed maintenance treatment for non-squamous non-small-cell lung cancer after pemetrexed and cisplatin,Approved,2016-08-24
Ramucirumab for previously treated locally advanced or metastatic non-small-cell lung cancer,Rejected,2016-08-24
Degarelix for treating advanced hormone-dependent prostate cancer,Conditional,2016-08-24
Trifluridine–tipiracil for previously treated metastatic colorectal cancer,Approved,2016-08-24
Cabazitaxel for hormone-relapsed metastatic prostate cancer treated with docetaxel,Rejected,2016-05-25
Abiraterone for castration-resistant metastatic prostate cancer previously treated with a docetaxel-containing regimen,Conditional,2012-06-27
Azacitidine for treating acute myeloid leukaemia with more than 30% bone marrow blasts,Rejected,2016-07-27
Nivolumab in combination with ipilimumab for treating advanced melanoma,Approved,2016-07-27
Abiraterone for treating metastatic hormone-relapsed prostate cancer before chemotherapy is indicated,Approved,2016-04-27
Alirocumab for treating primary hypercholesterolaemia and mixed dyslipidaemia,Conditional,2016-06-22
Evolocumab for treating primary hypercholesterolaemia and mixed dyslipidaemia,Conditional,2016-06-22
Ceritinib for previously treated anaplastic lymphoma kinase positive non-small-cell lung cancer,Conditional,2016-06-22
Trametinib in combination with dabrafenib for treating unresectable or metastatic melanoma,Approved,2016-06-22
Adalimumab for treating moderate to severe hidradenitis suppurativa,Conditional,2016-06-22
"Canagliflozin, dapagliflozin and empagliflozin as monotherapies for treating type 2 diabetes",Rejected,2016-05-25
Sacubitril valsartan for treating symptomatic chronic heart failure with reduced ejection fraction,Approved,2016-04-27
"Topotecan, pegylated liposomal doxorubicin hydrochloride, paclitaxel, trabectedin and gemcitabine for treating recurrent ovarian cancer",Rejected,2016-04-27
Ruxolitinib for treating disease-related splenomegaly or symptoms in adults with myelofibrosis,Rejected,2016-03-23
Guidance on the use of temozolomide for the treatment of recurrent malignant glioma (brain cancer),Rejected,2001-04-26
Ezetimibe for treating primary heterozygous-familial and non-familial hypercholesterolaemia,Approved,2016-02-24
Nivolumab for treating advanced (unresectable or metastatic) melanoma,Approved,2016-02-18
TNF-alpha inhibitors for ankylosing spondylitis and non-radiographic axial spondyloarthritis,Conditional,2016-02-01
Enzalutamide for treating metastatic hormone-relapsed prostate cancer before chemotherapy is indicated,Approved,2016-01-27
Ramucirumab for treating advanced gastric cancer or gastro–oesophageal junction adenocarcinoma previously treated with chemotherapy,Rejected,2016-01-27
Nintedanib for treating idiopathic pulmonary fibrosis,Rejected,2016-01-27
Panobinostat for treating multiple myeloma after at least 2 previous treatments,Approved,2016-01-27
Eltrombopag for treating severe aplastic anaemia refractory to immunosuppressive therapy (terminated appraisal),Rejected,2016-01-27
"Adalimumab, etanercept, infliximab, certolizumab pegol, golimumab, tocilizumab and abatacept for rheumatoid arthritis not previously treated with DMARDs or after conventional DMARDs only have failed",Rejected,2016-01-26
Guidance on the use of imatinib for chronic myeloid leukaemia,Approved,2003-10-22
Ciclosporin for treating dry eye disease that has not improved despite treatment with artificial tears,Approved,2015-12-16
Bortezomib for previously untreated mantle cell lymphoma,Approved,2015-12-16
"Abatacept, adalimumab, etanercept and tocilizumab for treating juvenile idiopathic arthritis",Approved,2015-12-16
Erlotinib and gefitinib for treating non-small-cell lung cancer that has progressed after prior chemotherapy,Rejected,2015-12-16
Ombitasvir–paritaprevir–ritonavir with or without dasabuvir for treating chronic hepatitis C,Conditional,2015-11-25
Vortioxetine for treating major depressive episodes,Rejected,2015-11-25
Ledipasvir–sofosbuvir for treating chronic hepatitis C,Rejected,2015-11-25
Tolvaptan for treating autosomal dominant polycystic kidney disease,Rejected,2015-10-28
Idelalisib for treating chronic lymphocytic leukaemia,Rejected,2015-10-28
Paclitaxel as albumin-bound nanoparticles with carboplatin for untreated non-small-cell lung cancer (terminated appraisal),Rejected,2015-10-28
Vedolizumab for treating moderately to severely active Crohn's disease after prior therapy,Rejected,2015-08-26
"Bevacizumab for treating relapsed, platinum‑resistant epithelial ovarian, fallopian tube or primary peritoneal cancer (terminated appraisal)",Rejected,2015-08-26
Edoxaban for treating and for preventing deep vein thrombosis and pulmonary embolism,Approved,2015-08-26
Naloxegol for treating opioid‑induced constipation,Approved,2015-07-22
Aflibercept for treating diabetic macular oedema,Rejected,2015-07-22
"Nintedanib for previously treated locally advanced, metastatic, or locally recurrent non‑small‑cell lung cancer",Conditional,2015-07-22
Everolimus for preventing organ rejection in liver transplantation,Rejected,2015-07-22
Secukinumab for treating moderate to severe plaque psoriasis,Rejected,2015-07-22
Cangrelor for reducing atherothrombotic events in people undergoing percutaneous coronary intervention or awaiting surgery requiring interruption of anti‑platelet therapy (terminated appraisal),Rejected,2015-07-22
Omalizumab for previously treated chronic spontaneous urticaria,Rejected,2015-06-08
Vedolizumab for treating moderately to severely active ulcerative colitis,Conditional,2015-06-05
Apixaban for the treatment and secondary prevention of deep vein thrombosis and/or pulmonary embolism,Approved,2015-06-04
Obinutuzumab in combination with chlorambucil for untreated chronic lymphocytic leukaemia,Rejected,2015-06-02
Rivaroxaban for preventing adverse outcomes after acute management of acute coronary syndrome,Approved,2015-03-25
Empagliflozin in combination therapy for treating type 2 diabetes,Rejected,2015-03-25
Rifaximin for preventing episodes of overt hepatic encephalopathy,Approved,2015-03-25
"Infliximab, adalimumab and golimumab for treating moderately to severely active ulcerative colitis after the failure of conventional therapy",Conditional,2015-02-25
Sofosbuvir for treating chronic hepatitis C,Rejected,2015-02-25
Axitinib for treating advanced renal cell carcinoma after failure of prior systemic treatment,Conditional,2015-02-25
Regorafenib for metastatic colorectal cancer after treatment for metastatic disease (terminated appraisal),Rejected,2015-02-25
Vemurafenib for treating locally advanced or metastatic BRAF V600 mutation‑positive malignant melanoma,Conditional,2012-12-12
Dabigatran etexilate for the treatment and secondary prevention of deep vein thrombosis and/or pulmonary embolism,Approved,2014-12-17
Erythropoiesis‑stimulating agents (epoetin and darbepoetin) for treating anaemia in people with cancer having chemotherapy,Rejected,2014-11-26
Dual‑chamber pacemakers for symptomatic bradycardia due to sick sinus syndrome without atrioventricular block,Rejected,2014-11-26
Nalmefene for reducing alcohol consumption in people with alcohol dependence,Approved,2014-11-26
Imatinib for the adjuvant treatment of gastrointestinal stromal tumours,Rejected,2014-11-26
Dual‑chamber pacemakers for symptomatic bradycardia due to sick sinus syndrome and/or atrioventricular block,Approved,2005-02-23
Dabrafenib for treating unresectable or metastatic BRAF V600 mutation‑positive melanoma,Conditional,2014-10-22
Dimethyl fumarate for treating relapsing‑remitting multiple sclerosis,Rejected,2014-08-27
Enzalutamide for metastatic hormone‑relapsed prostate cancer previously treated with a docetaxel‑containing regimen,Conditional,2014-07-23
Prasugrel with percutaneous coronary intervention for treating acute coronary syndromes,Approved,2014-07-23
Ipilimumab for previously untreated advanced (unresectable or metastatic) melanoma,Conditional,2014-07-23
Canagliflozin in combination therapy for treating type 2 diabetes,Rejected,2014-06-25
Implantable cardioverter defibrillators and cardiac resynchronisation therapy for arrhythmias and heart failure,Rejected,2014-06-25
Teriflunomide for treating relapsing–remitting multiple sclerosis,Rejected,2014-01-22
Afatinib for treating epidermal growth factor receptor mutation-positive locally advanced or metastatic non-small-cell lung cancer,Conditional,2014-04-23
Bortezomib for induction therapy in multiple myeloma before high-dose chemotherapy and autologous stem cell transplantation,Approved,2014-04-23
Rituximab in combination with glucocorticoids for treating anti-neutrophil cytoplasmic antibody-associated vasculitis,Rejected,2014-03-26
Aflibercept in combination with irinotecan and fluorouracil-based therapy for treating metastatic colorectal cancer that has progressed following prior oxaliplatin-based chemotherapy,Rejected,2014-03-25
Total hip replacement and resurfacing arthroplasty for end-stage arthritis of the hip,Conditional,2014-02-26
Aflibercept for treating visual impairment caused by macular oedema secondary to central retinal vein occlusion,Conditional,2014-02-26
Pixantrone monotherapy for treating multiply relapsed or refractory aggressive non-Hodgkin's B‑cell lymphoma,Rejected,2014-02-26
Peginterferon alfa and ribavirin for treating chronic hepatitis C in children and young people,Approved,2013-11-27
Canakinumab for treating systemic juvenile idiopathic arthritis (terminated appraisal),Rejected,2013-11-27
Peginterferon alfa and ribavirin for the treatment of mild chronic hepatitis C,Approved,2006-08-23
Interferon alfa (pegylated and non-pegylated) and ribavirin for the treatment of chronic hepatitis C,Approved,2004-01-28
Pazopanib for the first-line treatment of advanced renal cell carcinoma,Approved,2011-02-23
Aripiprazole for treating moderate to severe manic episodes in adolescents with bipolar I disorder,Approved,2013-07-24
Aflibercept solution for injection for treating wet age‑related macular degeneration,Conditional,2013-07-24
Rivaroxaban for treating pulmonary embolism and preventing recurrent venous thromboembolism,Approved,2013-06-26
Mirabegron for treating symptoms of overactive bladder,Rejected,2013-06-26
Bevacizumab in combination with paclitaxel and carboplatin for first-line treatment of advanced ovarian cancer,Rejected,2013-05-22
Bevacizumab in combination with gemcitabine and carboplatin for treating the first recurrence of platinum-sensitive advanced ovarian cancer,Rejected,2013-05-22
Loxapine inhalation for treating acute agitation and disturbed behaviours associated with schizophrenia and bipolar disorder (terminated appraisal),Rejected,2013-05-22
Omalizumab for treating severe persistent allergic asthma,Conditional,2013-04-24
Percutaneous vertebroplasty and percutaneous balloon kyphoplasty for treating osteoporotic vertebral compression fractures,Rejected,2013-04-24
Colistimethate sodium and tobramycin dry powders for inhalation for treating pseudomonas lung infection in cystic fibrosis,Rejected,2013-03-27
Methylnaltrexone for treating opioid-induced bowel dysfunction in people with advanced illness receiving palliative care (terminated appraisal),Rejected,2013-03-27
Vinflunine for the treatment of advanced or metastatic transitional cell carcinoma of the urothelial tract,Rejected,2013-01-23
Tadalafil for the treatment of symptoms associated with benign prostatic hyperplasia (terminated appraisal),Rejected,2013-01-23
Ipilimumab for previously treated advanced (unresectable or metastatic) melanoma,Conditional,2012-12-12
Decitabine for the treatment of acute myeloid leukaemia (terminated appraisal),Rejected,2012-12-12
Dronedarone for the treatment of non-permanent atrial fibrillation,Approved,2010-08-25
Mannitol dry powder for inhalation for treating cystic fibrosis,Approved,2012-11-28
Ivabradine for treating chronic heart failure,Approved,2012-11-28
Denosumab for the prevention of skeletal-related events in adults with bone metastases from solid tumours,Rejected,2012-10-24
Alteplase for treating acute ischaemic stroke,Approved,2012-09-26
