Title,Decision,Decision_Date
Bevacizumab in combination with capecitabine for the first-line treatment of metastatic breast cancer,Rejected,2012-08-22
Rivaroxaban for the treatment of deep vein thrombosis and prevention of recurrent deep vein thrombosis and pulmonary embolism,Approved,2012-07-25
Erlotinib for the first-line treatment of locally advanced or metastatic EGFR-TK mutation-positive non-small-cell lung cancer,Approved,2012-06-27
Botulinum toxin type A for the prevention of headaches in adults with chronic migraine,Rejected,2012-06-27
Lapatinib or trastuzumab in combination with an aromatase inhibitor for the first-line treatment of metastatic hormone receptor-positive breast cancer that overexpresses HER2,Rejected,2012-06-27
Rivaroxaban for the prevention of stroke and systemic embolism in people with atrial fibrillation,Approved,2012-05-23
Fingolimod for the treatment of highly active relapsing–remitting multiple sclerosis,Conditional,2012-04-25
Dabigatran etexilate for the prevention of stroke and systemic embolism in atrial fibrillation,Approved,2012-03-15
Pharmalgen for the treatment of bee and wasp venom allergy,Approved,2012-02-22
Tocilizumab for the treatment of rheumatoid arthritis,Approved,2012-02-22
Rituximab for the first-line treatment of stage III-IV follicular lymphoma,Rejected,2012-01-25
Apixaban for the prevention of venous thromboembolism after total hip or knee replacement in adults,Approved,2012-01-25
"Cetuximab, bevacizumab and panitumumab for the treatment of metastatic colorectal cancer after first-line chemotherapy",Rejected,2012-01-25
Bevacizumab and cetuximab for the treatment of metastatic colorectal cancer,Rejected,2007-01-24
Tocilizumab for the treatment of systemic juvenile idiopathic arthritis,Rejected,2011-12-14
Fulvestrant for the treatment of locally advanced or metastatic breast cancer,Rejected,2011-12-14
Mifamurtide for the treatment of osteosarcoma,Approved,2011-10-26
Ticagrelor for the treatment of acute coronary syndromes,Approved,2011-10-26
Bortezomib and thalidomide for the first‑line treatment of multiple myeloma,Approved,2011-07-27
Dexamethasone intravitreal implant for the treatment of macular oedema secondary to retinal vein occlusion,Approved,2011-07-27
Agomelatine for the treatment of major depressive episodes (terminated appraisal),Rejected,2011-07-27
Myocardial perfusion scintigraphy for the diagnosis and management of angina and myocardial infarction,Approved,2003-11-26
Erlotinib monotherapy for maintenance treatment of non-small-cell lung cancer,Rejected,2011-06-29
Golimumab for the treatment of rheumatoid arthritis after the failure of previous disease-modifying anti-rheumatic drugs,Approved,2011-06-22
Rituximab for the first-line maintenance treatment of follicular non-Hodgkin's lymphoma,Approved,2011-06-22
"Cilostazol, naftidrofuryl oxalate, pentoxifylline and inositol nicotinate for the treatment of intermittent claudication in people with peripheral arterial disease",Rejected,2011-05-25
Golimumab for the treatment of psoriatic arthritis,Conditional,2011-04-27
"Azacitidine for the treatment of myelodysplastic syndromes, chronic myelomonocytic leukaemia and acute myeloid leukaemia",Approved,2011-03-23
Bevacizumab in combination with a taxane for the first-line treatment of metastatic breast cancer,Rejected,2011-02-23
Bendamustine for the first-line treatment of chronic lymphocytic leukaemia,Approved,2011-02-23
Aripiprazole for the treatment of schizophrenia in people aged 15 to 17 years,Approved,2011-01-26
Clopidogrel and modified-release dipyridamole for the prevention of occlusive vascular events,Conditional,2010-12-15
Prucalopride for the treatment of chronic constipation in women,Approved,2010-12-15
Bevacizumab in combination with oxaliplatin and either fluorouracil plus folinic acid or capecitabine for the treatment of metastatic colorectal cancer,Rejected,2010-12-15
Trastuzumab for the treatment of HER2-positive metastatic gastric cancer,Approved,2010-11-24
Imatinib for the treatment of unresectable and/or metastatic gastrointestinal stromal tumours,Rejected,2010-11-24
Imatinib for the treatment of unresectable and/or metastatic gastro-intestinal stromal tumours,Rejected,2004-10-27
Denosumab for the prevention of osteoporotic fractures in postmenopausal women,Approved,2010-10-27
Bendamustine for the treatment of indolent (low grade) non-Hodgkin's lymphoma that is refractory to rituximab (terminated appraisal),Rejected,2010-10-27
Temsirolimus for the treatment of relapsed or refractory mantle cell lymphoma (terminated appraisal),Rejected,2010-10-27
Peginterferon alfa and ribavirin for the treatment of chronic hepatitis C,Approved,2010-09-22
"Adalimumab, etanercept, infliximab, rituximab and abatacept for the treatment of rheumatoid arthritis after the failure of a TNF inhibitor",Conditional,2010-08-25
"Etanercept, infliximab and adalimumab for the treatment of psoriatic arthritis",Rejected,2010-08-25
Capecitabine for the treatment of advanced gastric cancer,Approved,2010-07-28
Gefitinib for the first-line treatment of locally advanced or metastatic non-small-cell lung cancer,Approved,2010-07-28
Rituximab for the treatment of relapsed or refractory chronic lymphocytic leukaemia,Approved,2010-07-28
Human growth hormone (somatropin) for the treatment of growth failure in children,Approved,2010-05-26
Infliximab and adalimumab for the treatment of Crohn's disease,Approved,2010-05-19
Guidance on the use of glycoprotein IIb/IIIa inhibitors in the treatment of acute coronary syndromes,Rejected,2002-09-05
Topotecan for the treatment of relapsed small-cell lung cancer,Rejected,2009-11-25
Topotecan for the treatment of recurrent and stage IVB cervical cancer,Conditional,2009-10-28
Guidance on the use of electroconvulsive therapy,Approved,2003-04-26
Sunitinib for the treatment of gastrointestinal stromal tumours,Approved,2009-09-23
Pemetrexed for the first-line treatment of non-small-cell lung cancer,Conditional,2009-09-23
Alitretinoin for the treatment of severe chronic hand eczema,Approved,2009-08-26
"Bevacizumab (first-line), sorafenib (first- and second-line), sunitinib (second-line) and temsirolimus (first-line) for the treatment of advanced and/or metastatic renal cell carcinoma",Rejected,2009-08-26
Tenofovir disoproxil for the treatment of chronic hepatitis B,Approved,2009-07-22
Rituximab for the first-line treatment of chronic lymphocytic leukaemia,Rejected,2009-07-22
Rivaroxaban for the prevention of venous thromboembolism after total hip or total knee replacement in adults,Approved,2009-04-22
Sunitinib for the first-line treatment of advanced and/or metastatic renal cell carcinoma,Approved,2009-03-25
"Amantadine, oseltamivir and zanamivir for the treatment of influenza",Rejected,2009-02-25
Machine perfusion systems and cold static storage of kidneys from deceased donors,Rejected,2009-01-28
Infliximab for acute exacerbations of ulcerative colitis,Approved,2008-12-17
Spinal cord stimulation for chronic pain of neuropathic or ischaemic origin,Rejected,2008-10-22
Dabigatran etexilate for the prevention of venous thromboembolism after hip or knee replacement surgery in adults,Approved,2008-09-24
"Oseltamivir, amantadine (review) and zanamivir for the prophylaxis of influenza",Rejected,2008-09-24
Routine antenatal anti-D prophylaxis for women who are rhesus D negative,Approved,2008-08-27
Entecavir for the treatment of chronic hepatitis B,Approved,2008-08-27
Telbivudine for the treatment of chronic hepatitis B,Rejected,2008-08-27
Continuous subcutaneous insulin infusion for the treatment of diabetes mellitus,Rejected,2008-07-23
Bevacizumab for the treatment of non-small-cell lung cancer (terminated appraisal),Rejected,2008-06-25
Carmustine implants for the treatment of recurrent glioblastoma multiforme (terminated appraisal),Rejected,2008-06-25
Cetuximab for the treatment of locally advanced squamous cell cancer of the head and neck,Approved,2008-06-25
Adalimumab for the treatment of adults with psoriasis,Approved,2008-06-25
Structural neuroimaging in first-episode psychosis,Rejected,2008-02-27
Rituximab for the treatment of relapsed or refractory stage III or IV follicular non-Hodgkin's lymphoma,Approved,2008-02-27
Infliximab for the treatment of adults with psoriasis,Approved,2008-01-23
Pemetrexed for the treatment of malignant pleural mesothelioma,Approved,2008-01-23
Bortezomib monotherapy for relapsed multiple myeloma,Approved,2007-10-23
Stapled haemorrhoidopexy for the treatment of haemorrhoids,Approved,2007-09-26
Pemetrexed for the treatment of non-small-cell lung cancer,Rejected,2007-08-22
Varenicline for smoking cessation,Approved,2007-07-25
Carmustine implants and temozolomide for the treatment of newly diagnosed high-grade glioma,Rejected,2007-06-27
Fludarabine monotherapy for the first-line treatment of chronic lymphocytic leukaemia,Rejected,2007-02-28
Cinacalcet for the treatment of secondary hyperparathyroidism in patients with end-stage renal disease on maintenance dialysis therapy,Rejected,2007-01-24
Methadone and buprenorphine for the management of opioid dependence,Rejected,2007-01-24
Naltrexone for the management of opioid dependence,Approved,2007-01-24
Gemcitabine for the treatment of metastatic breast cancer,Approved,2007-01-24
Laparoscopic surgery for colorectal cancer,Approved,2006-08-23
Etanercept and efalizumab for the treatment of adults with psoriasis,Rejected,2006-07-26
Docetaxel for the treatment of hormone-refractory metastatic prostate cancer,Rejected,2006-06-28
Capecitabine and oxaliplatin in the adjuvant treatment of stage III (Dukes' C) colon cancer,Rejected,2006-04-26
Adefovir dipivoxil and peginterferon alfa-2a for the treatment of chronic hepatitis B,Approved,2006-02-22
HealOzone for the treatment of tooth decay (occlusal pit and fissure caries and root caries),Rejected,2005-07-27
Guidance on the use of paclitaxel in the treatment of ovarian cancer,Approved,2003-01-22
Laparoscopic surgery for inguinal hernia repair,Approved,2004-09-22
Tacrolimus and pimecrolimus for atopic eczema,Rejected,2004-08-25
Frequency of application of topical corticosteroids for atopic eczema,Approved,2004-08-25
"Guidance on the use of zaleplon, zolpidem and zopiclone for the short-term management of insomnia",Approved,2004-04-28
Fluid-filled thermal balloon and microwave endometrial ablation techniques for heavy menstrual bleeding,Rejected,2004-04-28
Pre-hospital initiation of fluid replacement therapy in trauma,Approved,2004-01-28
Guidance on the use of liquid-based cytology for cervical screening,Approved,2003-10-22
Human growth hormone (somatropin) in adults with growth hormone deficiency,Conditional,2003-08-27
Guidance on the use of capecitabine and tegafur with uracil for metastatic colorectal cancer,Approved,2003-05-27
Guidance on the use of drugs for early thrombolysis in the treatment of acute myocardial infarction,Approved,2002-10-30
Guidance on the use of ultrasound locating devices for placing central venous catheters,Rejected,2002-10-04
Guidance on the use of trastuzumab for the treatment of advanced breast cancer,Approved,2002-03-15
Guidance on the use of fludarabine for B-cell chronic lymphocytic leukaemia,Approved,2001-09-26
Guidance on the use of riluzole (Rilutek) for the treatment of motor neurone disease,Approved,2001-01-23
Guidance on the extraction of wisdom teeth,Rejected,2000-03-27
