Title,Decision,Decision_Date
Vedolizumab for treating chronic refractory pouchitis after surgery for ulcerative colitis (terminated appraisal),Rejected,2022-09-21
Melphalan for haematological diseases before allogeneic haematopoietic stem cell transplant (terminated appraisal),Rejected,2022-09-14
Dexamethasone intravitreal implant for treating diabetic macular oedema,Conditional,2022-09-14
Brolucizumab for treating diabetic macular oedema,Conditional,2022-08-31
Avalglucosidase alfa for treating Pompe disease,Conditional,2022-08-24
Sacituzumab govitecan for treating unresectable triple-negative advanced breast cancer after 2 or more therapies,Conditional,2022-08-17
Nivolumab with ipilimumab for untreated unresectable malignant pleural mesothelioma,Conditional,2022-08-17
Guselkumab for treating active psoriatic arthritis after inadequate response to DMARDs,Conditional,2022-08-10
"Alpelisib with fulvestrant for treating hormone receptor-positive, HER2-negative, PIK3CA-mutated advanced breast cancer",Conditional,2022-08-10
Nivolumab for adjuvant treatment of invasive urothelial cancer at high risk of recurrence,Conditional,2022-08-10
Pralsetinib for treating RET fusion-positive advanced non-small-cell lung cancer,Rejected,2022-08-03
Asciminib for treating chronic myeloid leukaemia after 2 or more tyrosine kinase inhibitors,Conditional,2022-08-03
"Abrocitinib, tralokinumab or upadacitinib for treating moderate to severe atopic dermatitis",Conditional,2022-08-03
Duvelisib for treating relapsed or refractory chronic lymphocytic leukaemia after 2 or more treatments (terminated appraisal),Rejected,2022-07-27
Imlifidase for desensitisation treatment before kidney transplant in people with chronic kidney disease,Approved,2022-07-20
"Abemaciclib with endocrine therapy for adjuvant treatment of hormone receptor-positive, HER2-negative, node-positive early breast cancer at high risk of recurrence",Approved,2022-07-20
Risankizumab for treating active psoriatic arthritis after inadequate response to DMARDs,Conditional,2022-07-13
Icosapent ethyl with statin therapy for reducing the risk of cardiovascular events in people with raised triglycerides,Conditional,2022-07-13
Belimumab for treating lupus nephritis (terminated appraisal),Rejected,2022-07-13
Roxadustat for treating symptomatic anaemia in chronic kidney disease,Conditional,2022-07-13
Fenfluramine for treating seizures associated with Dravet syndrome,Conditional,2022-07-08
Teduglutide for treating short bowel syndrome,Conditional,2022-06-30
Faricimab for treating diabetic macular oedema,Conditional,2022-06-29
Faricimab for treating wet age-related macular degeneration,Conditional,2022-06-29
"Pembrolizumab plus chemotherapy for untreated, triple-negative, locally recurrent unresectable or metastatic breast cancer",Conditional,2022-06-29
Cemiplimab for treating advanced cutaneous squamous cell carcinoma,Conditional,2022-06-29
Durvalumab for maintenance treatment of unresectable non-small-cell lung cancer after platinum-based chemoradiation,Conditional,2022-06-22
Venetoclax for treating chronic lymphocytic leukaemia,Approved,2022-06-15
Enfortumab vedotin for previously treated locally advanced or metastatic urothelial cancer (terminated appraisal),Rejected,2022-06-15
Anifrolumab for treating active autoantibody-positive systemic lupus erythematosus (terminated appraisal),Rejected,2022-06-08
Diroximel fumarate for treating relapsing–remitting multiple sclerosis,Conditional,2022-06-08
Ibrutinib for treating Waldenstrom’s macroglobulinaemia,Rejected,2022-06-08
Filgotinib for treating moderately to severely active ulcerative colitis,Approved,2022-06-01
TYRX Absorbable Antibacterial Envelope for preventing infection from cardiac implantable electronic devices (terminated appraisal),Rejected,2022-05-25
Romosozumab for treating severe osteoporosis,Conditional,2022-05-25
Tepotinib for treating advanced non-small-cell lung cancer with MET gene alterations,Conditional,2022-05-18
Avelumab for maintenance treatment of locally advanced or metastatic urothelial cancer after platinum-based chemotherapy,Conditional,2022-05-11
Tucatinib with trastuzumab and capecitabine for treating HER2-positive advanced breast cancer after 2 or more anti-HER2 therapies,Conditional,2022-04-27
Venetoclax with low dose cytarabine for untreated acute myeloid leukaemia when intensive chemotherapy is unsuitable,Conditional,2022-04-27
"Niraparib for maintenance treatment of relapsed, platinum-sensitive ovarian, fallopian tube and peritoneal cancer",Conditional,2022-04-20
Nivolumab with cabozantinib for untreated advanced renal cell carcinoma (terminated appraisal),Rejected,2022-04-20
Daratumumab monotherapy for treating relapsed and refractory multiple myeloma,Conditional,2022-04-13
Sotorasib for previously treated KRAS G12C mutation-positive advanced non-small-cell lung cancer,Conditional,2022-03-30
Tagraxofusp for treating blastic plasmacytoid dendritic cell neoplasm (terminated appraisal),Rejected,2022-03-30
Nivolumab with ipilimumab for untreated advanced renal cell carcinoma,Approved,2022-03-24
Dostarlimab for previously treated advanced or recurrent endometrial cancer with high microsatellite instability or mismatch repair deficiency,Conditional,2022-03-16
Lenalidomide for relapsed or refractory mantle cell lymphoma (terminated appraisal),Rejected,2022-03-09
Empagliflozin for treating chronic heart failure with reduced ejection fraction,Conditional,2022-03-09
Pitolisant hydrochloride for treating excessive daytime sleepiness caused by obstructive sleep apnoea,Rejected,2022-03-09
Solriamfetol for treating excessive daytime sleepiness caused by obstructive sleep apnoea,Rejected,2022-03-09
Pegcetacoplan for treating paroxysmal nocturnal haemoglobinuria,Conditional,2022-03-09
Dapagliflozin for treating chronic kidney disease,Conditional,2022-03-09
Pembrolizumab for treating relapsed or refractory classical Hodgkin lymphoma after stem cell transplant or at least 2 previous therapies,Conditional,2022-02-23
Pembrolizumab with carboplatin and paclitaxel for untreated metastatic squamous non-small-cell lung cancer,Conditional,2022-02-09
"Daratumumab with bortezomib, melphalan and prednisone for untreated multiple myeloma (terminated appraisal)",Rejected,2022-02-09
Daratumumab in combination for untreated multiple myeloma when a stem cell transplant is suitable,Conditional,2022-02-02
Fremanezumab for preventing migraine,Conditional,2022-02-02
Venetoclax with azacitidine for untreated acute myeloid leukaemia when intensive chemotherapy is unsuitable,Conditional,2022-02-02
Pembrolizumab for adjuvant treatment of completely resected stage 3 melanoma,Conditional,2022-02-02
Ponesimod for treating relapsing–remitting multiple sclerosis,Conditional,2022-02-02
Upadacitinib for treating active psoriatic arthritis after inadequate response to DMARDs,Conditional,2022-02-02
Palforzia for treating peanut allergy in children and young people,Approved,2022-02-02
Sodium zirconium cyclosilicate for treating hyperkalaemia,Conditional,2019-09-04
Osimertinib for adjuvant treatment of EGFR mutation-positive non-small-cell lung cancer after complete tumour resection,Conditional,2022-01-19
Cabotegravir with rilpivirine for treating HIV-1,Approved,2022-01-05
Solriamfetol for treating excessive daytime sleepiness caused by narcolepsy,Conditional,2022-01-05
Belimumab for treating active autoantibody-positive systemic lupus erythematosus,Conditional,2021-12-15
Cenobamate for treating focal onset seizures in epilepsy,Conditional,2021-12-15
Mogamulizumab for previously treated mycosis fungoides and Sézary syndrome,Conditional,2021-12-15
Olaparib for maintenance treatment of BRCA mutation-positive metastatic pancreatic cancer after platinum-based chemotherapy (terminated appraisal),Rejected,2021-12-08
Dupilumab for treating severe asthma with type 2 inflammation,Conditional,2021-12-08
Mexiletine for treating the symptoms of myotonia in non-dystrophic myotonic disorders,Conditional,2021-12-01
Liraglutide for managing obesity in people aged 12 to 17 years (terminated appraisal),Rejected,2021-12-01
Nivolumab for adjuvant treatment of resected oesophageal or gastro-oesophageal junction cancer,Conditional,2021-11-17
Nintedanib for treating progressive fibrosing interstitial lung diseases,Approved,2021-11-17
Upadacitinib for treating moderate rheumatoid arthritis,Conditional,2021-11-10
NBTXR-3 for treating advanced soft tissue sarcoma (terminated appraisal),Rejected,2021-11-10
Apalutamide with androgen deprivation therapy for treating high-risk hormone-relapsed non-metastatic prostate cancer,Conditional,2021-10-28
Apalutamide with androgen deprivation therapy for treating hormone-sensitive metastatic prostate cancer,Conditional,2021-10-28
Atezolizumab for untreated PD-L1-positive advanced urothelial cancer when cisplatin is unsuitable,Conditional,2021-10-27
Tofacitinib for treating juvenile idiopathic arthritis,Conditional,2021-10-20
Nivolumab for treating recurrent or metastatic squamous cell carcinoma of the head and neck after platinum-based chemotherapy,Conditional,2021-10-20
Berotralstat for preventing recurrent attacks of hereditary angioedema,Conditional,2021-10-20
Secukinumab for treating moderate to severe plaque psoriasis in children and young people,Conditional,2021-10-07
Baloxavir marboxil for treating acute uncomplicated influenza (terminated appraisal),Rejected,2021-10-06
Inclisiran for treating primary hypercholesterolaemia or mixed dyslipidaemia,Conditional,2021-10-06
Avapritinib for treating unresectable or metastatic gastrointestinal stromal tumours (terminated appraisal),Rejected,2021-09-29
Vericiguat for treating chronic heart failure with reduced ejection fraction (terminated appraisal),Rejected,2021-09-29
Daratumumab with pomalidomide and dexamethasone for treating relapsed or refractory multiple myeloma (terminated appraisal),Rejected,2021-09-22
Isatuximab with carfilzomib and dexamethasone for treating relapsed or refractory multiple myeloma (terminated appraisal),Rejected,2021-09-22
Midostaurin for treating advanced systemic mastocytosis,Conditional,2021-09-22
Sapropterin for treating hyperphenylalaninaemia in phenylketonuria,Conditional,2021-09-22
"Abemaciclib with fulvestrant for treating hormone receptor-positive, HER2-negative advanced breast cancer after endocrine therapy",Conditional,2021-09-15
Nivolumab with ipilimumab and chemotherapy for untreated metastatic non-small-cell lung cancer,Rejected,2021-09-08
Bimekizumab for treating moderate to severe plaque psoriasis,Conditional,2021-09-01
Pemigatinib for treating relapsed or refractory advanced cholangiocarcinoma with FGFR2 fusion or rearrangement,Conditional,2021-08-25
Continuous positive airway pressure for the treatment of obstructive sleep apnoea/hypopnoea syndrome,Approved,2008-03-26
Chlormethine gel for treating mycosis fungoides-type cutaneous T-cell lymphoma,Conditional,2021-08-18
Abiraterone for treating newly diagnosed high-risk hormone-sensitive metastatic prostate cancer,Rejected,2021-08-18
Nivolumab with ipilimumab for previously treated metastatic colorectal cancer with high microsatellite instability or mismatch repair deficiency,Conditional,2021-07-28
Duvelisib for treating relapsed follicular lymphoma after 2 or more systemic therapies (terminated appraisal),Rejected,2021-07-21
Ixekizumab for treating axial spondyloarthritis,Conditional,2021-07-21
Secukinumab for treating non-radiographic axial spondyloarthritis,Conditional,2021-07-21
"Adalimumab, etanercept, infliximab and abatacept for treating moderate rheumatoid arthritis after conventional DMARDs have failed",Rejected,2021-07-14
Dasatinib for treating Philadelphia-chromosome-positive acute lymphoblastic leukaemia (terminated appraisal),Rejected,2021-07-14
Enzalutamide for treating hormone-sensitive metastatic prostate cancer,Approved,2021-07-07
Nivolumab for advanced non-squamous non-small-cell lung cancer after chemotherapy,Conditional,2021-07-07
Apixaban for preventing stroke and systemic embolism in people with non-valvular atrial fibrillation,Approved,2013-02-27
Edoxaban for preventing stroke and systemic embolism in people with non-valvular atrial fibrillation,Approved,2015-09-23
Budesonide orodispersible tablet for inducing remission of eosinophilic oesophagitis,Approved,2021-06-23
Pembrolizumab for untreated metastatic colorectal cancer with high microsatellite instability or mismatch repair deficiency,Conditional,2021-06-23
Ravulizumab for treating atypical haemolytic uraemic syndrome,Approved,2021-06-23
Nivolumab for previously treated unresectable advanced or recurrent oesophageal cancer,Conditional,2021-06-15
Ozanimod for treating relapsing–remitting multiple sclerosis,Rejected,2021-06-09
Atezolizumab monotherapy for untreated advanced non-small-cell lung cancer,Approved,2021-06-02
Ibrutinib with obinutuzumab for untreated chronic lymphocytic leukaemia and small lymphocytic lymphoma (terminated appraisal),Rejected,2021-05-26
Ibrutinib with rituximab for untreated chronic lymphocytic leukaemia (terminated appraisal),Rejected,2021-05-26
Trastuzumab deruxtecan for treating HER2-positive unresectable or metastatic breast cancer after 2 or more anti-HER2 therapies,Conditional,2021-05-26
Ravulizumab for treating paroxysmal nocturnal haemoglobinuria,Approved,2021-05-19
Ofatumumab for treating relapsing multiple sclerosis,Conditional,2021-05-19
Crisaborole for treating mild to moderate atopic dermatitis in people 2 years and older (terminated appraisal),Rejected,2021-05-19
Pembrolizumab for treating locally advanced or metastatic urothelial carcinoma after platinum-containing chemotherapy,Rejected,2021-04-28
Bempedoic acid with ezetimibe for treating primary hypercholesterolaemia or mixed dyslipidaemia,Conditional,2021-04-28
Carfilzomib with dexamethasone and lenalidomide for previously treated multiple myeloma,Conditional,2021-04-28
Avelumab for treating metastatic Merkel cell carcinoma,Conditional,2018-04-11
Acalabrutinib for treating chronic lymphocytic leukaemia,Conditional,2021-04-21
Avelumab for untreated metastatic Merkel cell carcinoma,Conditional,2021-04-21
Anakinra for treating Still’s disease,Approved,2021-03-31
Blinatumomab for previously treated Philadelphia-chromosome-positive acute lymphoblastic leukaemia (terminated appraisal),Rejected,2021-03-31
"Ribociclib with fulvestrant for treating hormone receptor-positive, HER2-negative advanced breast cancer after endocrine therapy",Conditional,2021-03-31
Nivolumab for adjuvant treatment of completely resected melanoma with lymph node involvement or metastatic disease,Conditional,2021-03-17
Erenumab for preventing migraine,Conditional,2021-03-10
"Pembrolizumab with pemetrexed and platinum chemotherapy for untreated, metastatic, non-squamous non-small-cell lung cancer",Conditional,2021-03-10
Lenalidomide maintenance treatment after an autologous stem cell transplant for newly diagnosed multiple myeloma,Conditional,2021-03-03
Baricitinib for treating moderate to severe atopic dermatitis,Conditional,2021-03-03
Filgotinib for treating moderate to severe rheumatoid arthritis,Conditional,2021-02-24
Brexucabtagene autoleucel for treating relapsed or refractory mantle cell lymphoma,Approved,2021-02-24
Omalizumab for treating chronic rhinosinusitis with nasal polyps (terminated appraisal),Rejected,2021-02-24
Dapagliflozin for treating chronic heart failure with reduced ejection fraction,Conditional,2021-02-24
"Niraparib for maintenance treatment of advanced ovarian, fallopian tube and peritoneal cancer after response to first-line platinum-based chemotherapy",Conditional,2021-02-17
"Pembrolizumab for untreated PD-L1-positive, locally advanced or metastatic urothelial cancer when cisplatin is unsuitable (terminated appraisal)",Rejected,2021-02-17
Vernakalant for the rapid conversion of recent onset atrial fibrillation to sinus rhythm (terminated appraisal),Rejected,2021-02-17
Trabectedin for the treatment of advanced soft tissue sarcoma,Approved,2010-02-24
Mepolizumab for treating severe eosinophilic asthma,Conditional,2021-02-03
Brolucizumab for treating wet age-related macular degeneration,Conditional,2021-02-03
Brigatinib for ALK-positive advanced non-small-cell lung cancer that has not been previously treated with an ALK inhibitor,Conditional,2021-01-27
Encorafenib plus cetuximab for previously treated BRAF V600E mutation-positive metastatic colorectal cancer,Conditional,2021-01-06
Atezolizumab with bevacizumab for treating advanced or unresectable hepatocellular carcinoma,Conditional,2020-12-16
Caplacizumab with plasma exchange and immunosuppression for treating acute acquired thrombotic thrombocytopenic purpura,Conditional,2020-12-16
Venetoclax with obinutuzumab for untreated chronic lymphocytic leukaemia,Conditional,2020-12-09
Liraglutide for managing overweight and obesity,Conditional,2020-12-09
Upadacitinib for treating severe rheumatoid arthritis,Conditional,2020-12-09
Darolutamide with androgen deprivation therapy for treating hormone-relapsed non-metastatic prostate cancer,Conditional,2020-11-25
Pembrolizumab for untreated metastatic or unresectable recurrent head and neck squamous cell carcinoma,Conditional,2020-11-25
Durvalumab in combination for untreated extensive-stage small-cell lung cancer (terminated appraisal),Rejected,2020-11-25
Drug-eluting stents for the treatment of coronary artery disease,Conditional,2008-07-23
Guidance on the use of coronary artery stents,Rejected,2003-10-22
Siponimod for treating secondary progressive multiple sclerosis,Conditional,2020-11-18
Carfilzomib for previously treated multiple myeloma,Conditional,2020-11-18
Isatuximab with pomalidomide and dexamethasone for treating relapsed and refractory multiple myeloma,Conditional,2020-11-18
Galcanezumab for preventing migraine,Conditional,2020-11-18
Nivolumab for advanced squamous non-small-cell lung cancer after chemotherapy,Conditional,2020-10-21
Osimertinib for treating EGFR T790M mutation-positive advanced non-small-cell lung cancer,Conditional,2020-10-14
Osimertinib for untreated EGFR mutation-positive non-small-cell lung cancer,Conditional,2020-10-14
Pembrolizumab with axitinib for untreated advanced renal cell carcinoma,Rejected,2020-09-30
Naldemedine for treating opioid-induced constipation,Approved,2020-09-30
Polatuzumab vedotin with rituximab and bendamustine for treating relapsed or refractory diffuse large B-cell lymphoma,Conditional,2020-09-23
Dupilumab for treating chronic rhinosinusitis with nasal polyps (terminated appraisal),Rejected,2020-09-09
Glasdegib with chemotherapy for untreated acute myeloid leukaemia (terminated appraisal),Rejected,2020-09-02
Eculizumab for treating relapsing neuromyelitis optica (terminated appraisal),Rejected,2020-09-02
Avelumab with axitinib for untreated advanced renal cell carcinoma,Conditional,2020-09-02
Brentuximab vedotin in combination for untreated systemic anaplastic large cell lymphoma,Approved,2020-08-12
Gilteritinib for treating relapsed or refractory acute myeloid leukaemia,Conditional,2020-08-12
Entrectinib for treating ROS1-positive advanced non-small-cell lung cancer,Conditional,2020-08-12
Entrectinib for treating NTRK fusion-positive solid tumours,Approved,2020-08-12
Treosulfan with fludarabine for malignant disease before allogeneic stem cell transplant,Approved,2020-08-05
Atezolizumab with carboplatin and etoposide for untreated extensive-stage small-cell lung cancer,Conditional,2020-07-01
"Atezolizumab with nab-paclitaxel for untreated PD-L1-positive, locally advanced or metastatic, triple-negative breast cancer",Conditional,2020-07-01
Daratumumab with lenalidomide and dexamethasone for untreated multiple myeloma (terminated appraisal),Rejected,2020-06-30
Ramucirumab with erlotinib for untreated EGFR-positive metastatic non-small-cell lung cancer (terminated appraisal),Rejected,2020-06-30
Eculizumab for treating refractory myasthenia gravis (terminated appraisal),Rejected,2020-06-30
Ranibizumab for treating diabetic retinopathy (terminated appraisal),Rejected,2020-06-30
Avatrombopag for treating thrombocytopenia in people with chronic liver disease needing a planned invasive procedure,Approved,2020-06-24
Ustekinumab for treating moderately to severely active ulcerative colitis,Conditional,2020-06-17
Trastuzumab emtansine for adjuvant treatment of HER2-positive early breast cancer,Conditional,2020-06-10
Larotrectinib for treating NTRK fusion-positive solid tumours,Approved,2020-05-27
Lorlatinib for previously treated ALK-positive advanced non-small-cell lung cancer,Approved,2020-05-13
Obinutuzumab with bendamustine for treating follicular lymphoma after rituximab,Conditional,2020-05-13
Lenalidomide with rituximab for previously treated follicular lymphoma,Approved,2020-04-07
Recombinant human parathyroid hormone for treating hypoparathyroidism (terminated appraisal),Rejected,2020-03-04
Peginterferon beta-1a for treating relapsing–remitting multiple sclerosis,Approved,2020-02-19
Patiromer for treating hyperkalaemia,Conditional,2020-02-13
Sotagliflozin with insulin for treating type 1 diabetes,Conditional,2020-02-12
Atezolizumab with carboplatin and nab-paclitaxel for untreated advanced non-squamous non-small-cell lung cancer (terminated appraisal),Rejected,2020-01-15
Lusutrombopag for treating thrombocytopenia in people with chronic liver disease needing a planned invasive procedure,Approved,2020-01-08
Cannabidiol with clobazam for treating seizures associated with Dravet syndrome,Conditional,2019-12-18
Cannabidiol with clobazam for treating seizures associated with Lennox–Gastaut syndrome,Conditional,2019-12-18
"Neratinib for extended adjuvant treatment of hormone receptor-positive, HER2-positive early stage breast cancer after adjuvant trastuzumab",Conditional,2019-11-20
Pentosan polysulfate sodium for treating bladder pain syndrome,Conditional,2019-11-13
Ibrutinib with rituximab for treating Waldenstrom’s macroglobulinaemia (terminated appraisal),Rejected,2019-10-30
Ramucirumab for treating unresectable hepatocellular carcinoma after sorafenib (terminated appraisal),Rejected,2019-10-30
Rivaroxaban for preventing atherothrombotic events in people with coronary or peripheral artery disease,Approved,2019-10-17
Lanadelumab for preventing recurrent attacks of hereditary angioedema,Conditional,2019-10-16
Xeomin (botulinum neurotoxin type A) for treating chronic sialorrhoea,Conditional,2019-10-09
Idelalisib for treating refractory follicular lymphoma,Rejected,2019-10-02
Lenalidomide with bortezomib and dexamethasone for untreated multiple myeloma (terminated appraisal),Rejected,2019-09-25
Pomalidomide with bortezomib and dexamethasone for treating relapsed or refractory multiple myeloma (terminated appraisal),Rejected,2019-09-25
Benralizumab for treating severe eosinophilic asthma,Conditional,2019-03-06
Risankizumab for treating moderate to severe plaque psoriasis,Conditional,2019-08-21
Brentuximab vedotin for untreated advanced Hodgkin lymphoma (terminated appraisal),Rejected,2019-08-14
Dacomitinib for untreated EGFR mutation-positive non-small-cell lung cancer,Conditional,2019-08-14
Fluocinolone acetonide intravitreal implant for treating recurrent non-infectious uveitis,Conditional,2019-07-31
Letermovir for preventing cytomegalovirus disease after a stem cell transplant,Conditional,2019-07-31
Nusinersen for treating spinal muscular atrophy,Conditional,2019-07-24
Blinatumomab for treating acute lymphoblastic leukaemia in remission with minimal residual disease activity,Conditional,2019-07-24
Bisphosphonates for treating osteoporosis,Rejected,2017-08-09
Lenalidomide for treating myelodysplastic syndromes associated with an isolated deletion 5q cytogenetic abnormality,Conditional,2014-09-24
Lenalidomide for the treatment of multiple myeloma in people who have received at least 2 prior therapies,Conditional,2009-06-18
Lenalidomide plus dexamethasone for multiple myeloma after 1 treatment with bortezomib,Conditional,2019-06-26
Lenalidomide plus dexamethasone for previously untreated multiple myeloma,Conditional,2019-06-26
Ocrelizumab for treating primary progressive multiple sclerosis,Conditional,2019-06-12
Ertugliflozin with metformin and a dipeptidyl peptidase-4 inhibitor for treating type 2 diabetes,Conditional,2019-06-05
Atezolizumab in combination for treating metastatic non-squamous non-small-cell lung cancer,Approved,2019-06-05
Enzalutamide for hormone-relapsed non-metastatic prostate cancer,Rejected,2019-05-15
Brentuximab vedotin for treating CD30-positive cutaneous T-cell lymphoma,Conditional,2019-04-24
Certolizumab pegol for treating moderate to severe plaque psoriasis,Conditional,2019-04-17
Bosutinib for untreated chronic myeloid leukaemia (terminated appraisal),Rejected,2019-04-17
Tildrakizumab for treating moderate to severe plaque psoriasis,Conditional,2019-04-17
Ertugliflozin as monotherapy or with metformin for treating type 2 diabetes,Conditional,2019-03-27
Brigatinib for treating ALK-positive advanced non-small-cell lung cancer after crizotinib,Conditional,2019-03-20
Pembrolizumab for treating recurrent or metastatic squamous cell carcinoma of the head and neck after platinum-based chemotherapy (terminated appraisal),Rejected,2019-03-20
Pertuzumab for adjuvant treatment of HER2-positive early stage breast cancer,Conditional,2019-03-20
Abatacept for treating psoriatic arthritis after DMARDs (terminated appraisal),Rejected,2019-03-13
Cochlear implants for children and adults with severe to profound deafness,Rejected,2019-03-07
Venetoclax with rituximab for previously treated chronic lymphocytic leukaemia,Conditional,2019-02-27
Encorafenib with binimetinib for unresectable or metastatic BRAF V600 mutation-positive melanoma,Conditional,2019-02-27
"Abemaciclib with an aromatase inhibitor for previously untreated, hormone receptor-positive, HER2-negative, locally advanced or metastatic breast cancer",Conditional,2019-02-27
