Title,Recommendation text,Decision
"Adalimumab, etanercept, infliximab, certolizumab pegol, golimumab, tocilizumab and abatacept for rheumatoid arthritis not previously treated with DMARDs or after conventional DMARDs only have failed","1.1Adalimumab, etanercept, infliximab, certolizumab pegol, golimumab, tocilizumab and abatacept, all in combination with methotrexate, are recommended as options for treating rheumatoid arthritis, only if: | 1.2Adalimumab, etanercept, certolizumab pegol or tocilizumab can be used as monotherapy for people who cannot take methotrexate because it is contraindicated or because of intolerance, when the criteria in section 1.1 are met. | 1.3Continue treatment only if there is a moderate response measured using European League Against Rheumatism (EULAR) criteria at 6 months after starting therapy. | 1.4After initial response within 6 months, withdraw treatment if a moderate EULAR response is not maintained. | 1.5Start treatment with the least expensive drug (taking into account administration costs, dose needed and product price per dose). This may need to be varied for some people because of differences in the mode of administration and treatment schedules. | 1.6Take into account any physical, sensory or learning disabilities, or communication difficulties that could affect the responses to the DAS28 and make any appropriate adjustments. | 1.7People whose treatment with adalimumab, etanercept, infliximab, certolizumab pegol, golimumab, tocilizumab or abatacept is not recommended in this NICE guidance, but was started within the NHS before this guidance was published, should be able to continue treatment until they and their NHS clinician consider it appropriate to stop.",Rejected
Guidance on the use of imatinib for chronic myeloid leukaemia,"This recommendation has been updated and replaced byNICE's technology appraisal guidance on dasatinib, nilotinib and imatinib for untreated chronic myeloid leukaemia. | Imatinib is recommended as an option for the treatment of people with Philadelphia-chromosome-positive chronic myeloid leukaemia (CML) who initially present in the accelerated phase or with blast crisis. Additionally, imatinib is recommended as an option for people who present in the chronic phase and then progress to the accelerated phase or blast crisis if they have not received imatinib previously. | This recommendation has been updated and replaced byNICE's technology appraisal guidance on dasatinib, nilotinib and high-dose imatinib for treating imatinib-resistant or intolerant chronic myeloid leukaemia. | For people in chronic-phase CML who are currently receiving interferon alpha (IFN-alfa) as first-line treatment, the decision about whether to change to imatinib should be informed by the response of the disease to current treatment and by the tolerance of the person to IFN-alfa. This decision should be made after informed discussion between the person with CML and the clinician responsible for treatment, taking full account of the evidence on the risks and benefits of imatinib and the wishes of the person.",Approved
Ciclosporin for treating dry eye disease that has not improved despite treatment with artificial tears,"1.1Ciclosporin is recommended as an option, within its marketing authorisation, for treating severe keratitis in adult patients with dry eye disease that has not improved despite treatment with tear substitutes.",Approved
Bortezomib for previously untreated mantle cell lymphoma,"1.1Bortezomib is recommended, within its marketing authorisation, as an option for previously untreated mantle cell lymphoma in adults for whom haematopoietic stem cell transplantation is unsuitable.",Approved
"Abatacept, adalimumab, etanercept and tocilizumab for treating juvenile idiopathic arthritis","1.1Abatacept, adalimumab, etanercept and tocilizumab are recommended, within their marketing authorisations, as options for treating polyarticular juvenile idiopathic arthritis (JIA), including polyarticular‑onset, polyarticular‑course and extended oligoarticular JIA. That is: | 1.2Adalimumab and etanercept are recommended, within their marketing authorisations, as options for treating enthesitis‑related JIA, that is, for people 6 years and older (adalimumab) and 12 years and older (etanercept) whose disease has responded inadequately to, or who are intolerant of, conventional therapy. | 1.3Etanercept is recommended, within its marketing authorisation, as an option for treating psoriatic JIA, that is, in people aged 12 years and over whose disease has responded inadequately to, or who are intolerant of, methotrexate. | 1.4When more than 1 technology is suitable (taking into account extra‑articular manifestations) treatment should be started with the least expensive technology, taking into account administration costs, the dose needed and the product cost per dose.",Approved
Erlotinib and gefitinib for treating non-small-cell lung cancer that has progressed after prior chemotherapy,"1.1Erlotinib is recommended as an option for treating locally advanced or metastatic non‑small‑cell lung cancer that has progressed in people who have had non‑targeted chemotherapy because of delayed confirmation that their tumour is epidermal growth factor receptor tyrosine kinase (EGFR‑TK) mutation‑positive, only if the company provides erlotinib with the discount agreed in the patient access scheme revised in the context ofNICE technology appraisal guidance 258. | 1.2Erlotinib is recommended as an option for treating locally advanced or metastatic non‑small‑cell lung cancer that has progressed after non‑targeted chemotherapy in people with tumours of unknown EGFR‑TK mutation status, only if: | 1.3Erlotinib is not recommended for treating locally advanced or metastatic non‑small‑cell lung cancer that has progressed after non‑targeted chemotherapy in people with tumours that are EGFR‑TK mutation‑negative. | 1.4Gefitinib is not recommended for treating locally advanced or metastatic non‑small‑cell lung cancer that has progressed after non‑targeted chemotherapy in people with tumours that are EGFR‑TK mutation‑positive. | 1.5People whose treatment with erlotinib or gefitinib is not recommended in this NICE guidance, but was started within the NHS before this guidance was published, should be able to continue treatment until they and their NHS clinician consider it appropriate to stop.",Rejected
Ombitasvir–paritaprevir–ritonavir with or without dasabuvir for treating chronic hepatitis C,"1.1Ombitasvir–paritaprevir–ritonavir with or without dasabuvir is recommended, within its marketing authorisation, as an option for treating genotype 1 or 4 chronic hepatitis C in adults, as specified in table 1, only if the company provides ombitasvir–paritaprevir–ritonavir and dasabuvir at the same price or lower than that agreed with the Commercial Medicines Unit. | 1.2It is recommended that the decision to treat and prescribing decisions are made by multidisciplinary teams in the operational delivery networks put in place by NHS England, to prioritise treatment for people with the highest unmet clinical need.",Conditional
Vortioxetine for treating major depressive episodes,"Vortioxetine is recommended as an option for treating major depressive episodes in adults whose condition has responded inadequately to 2 antidepressants within the current episode. | People whose treatment with vortioxetine is not recommended in this NICE guidance, but was started within the NHS before this guidance was published, should be able to continue treatment until they and their NHS clinician consider it appropriate to stop.",Rejected
Ledipasvir–sofosbuvir for treating chronic hepatitis C,"1.1Ledipasvir–sofosbuvir is recommended as an option for treating chronic hepatitis C in adults, as specified in table 1. | 1.2It is recommended that the decision to treat and prescribing decisions are made by multidisciplinary teams in the operational delivery networks put in place by NHS England, to prioritise treatment for people with the highest unmet clinical need. | 1.3People whose treatment with ledipasvir–sofosbuvir is not recommended in this NICE guidance, but was started within the NHS before this guidance was published, should be able to continue treatment until they and their NHS clinician consider it appropriate to stop.",Rejected
Tolvaptan for treating autosomal dominant polycystic kidney disease,"1.1Tolvaptan is recommended as an option for treating autosomal dominant polycystic kidney disease in adults to slow the progression of cyst development and renal insufficiency only if: | 1.2People whose treatment with tolvaptan is not recommended in this NICE guidance, but was started within the NHS before this guidance was published, should be able to continue treatment until they and their NHS clinician consider it appropriate to stop.",Rejected
Idelalisib for treating chronic lymphocytic leukaemia,"1.1Idelalisib, in combination with rituximab, is recommended: | 1.2People whose treatment with idelalisib is not recommended in this NICE guidance but was started within the NHS before this guidance was published should be able to continue treatment until they and their NHS clinician consider it appropriate to stop.",Rejected
Paclitaxel as albumin-bound nanoparticles with carboplatin for untreated non-small-cell lung cancer (terminated appraisal),Recommendation Not Found,Rejected
Vedolizumab for treating moderately to severely active Crohn's disease after prior therapy,"1.1Vedolizumab is recommended as an option for treating moderately to severely active Crohn's disease only if: | 1.2Vedolizumab should be given as a planned course of treatment until it stops working or surgery is needed, or until 12 months after the start of treatment, whichever is shorter. At 12 months, people should be reassessed to determine whether treatment should continue. Treatment should only continue if there is clear evidence of ongoing clinical benefit. For people in complete remission at 12 months, consider stopping vedolizumab, resuming treatment if there is a relapse. People who continue vedolizumab should be reassessed at least every 12 months to decide whether continued treatment is justified. | 1.3People whose treatment with vedolizumab is not recommended in this NICE guidance, but was started within the NHS before this guidance was published, should be able to continue treatment until they and their NHS clinician consider it appropriate to stop.",Rejected
"Bevacizumab for treating relapsed, platinum‑resistant epithelial ovarian, fallopian tube or primary peritoneal cancer (terminated appraisal)",Recommendation Not Found,Rejected
Edoxaban for treating and for preventing deep vein thrombosis and pulmonary embolism,"Edoxaban is recommended, within its marketing authorisation, as an option for treating and for preventing recurrent deep vein thrombosis and pulmonary embolism in adults.",Approved
Naloxegol for treating opioid‑induced constipation,"Naloxegol is recommended, within its marketing authorisation, as an option for treating opioid induced constipation in adults whose constipation has not adequately responded to laxatives. An inadequate response is defined as opioid‑induced constipation symptoms of at least moderate severity in at least 1 of the 4 stool symptom domains (that is, incomplete bowel movement, hard stools, straining or false alarms) while taking at least 1 laxative class for at least 4 days during the prior 2 weeks.",Approved
Aflibercept for treating diabetic macular oedema,"1.1Aflibercept solution for injection is recommended as an option for treating visual impairment caused by diabetic macular oedema only if: | 1.2People whose treatment with aflibercept is not recommended in this NICE guidance, but was started within the NHS before this guidance was published, should be able to continue aflibercept until they and their NHS clinician consider it appropriate to stop.",Rejected
"Nintedanib for previously treated locally advanced, metastatic, or locally recurrent non‑small‑cell lung cancer","Nintedanib in combination with docetaxel is recommended, within its marketing authorisation, as an option for treating locally advanced, metastatic or locally recurrent non‑small‑cell lung cancer of adenocarcinoma histology that has progressed after first‑line chemotherapy, only if the company provides nintedanib with the discount agreed in the patient access scheme.",Conditional
Everolimus for preventing organ rejection in liver transplantation,"1.1Everolimus is not recommended within its marketing authorisation for preventing organ rejection in people having a liver transplant. | 1.2People whose treatment with everolimus was started within the NHS before this guidance was published, should be able to continue everolimus until they and their NHS clinician consider it appropriate to stop.",Rejected
Secukinumab for treating moderate to severe plaque psoriasis,"1.1Secukinumab is recommended, within its marketing authorisation, as an option for treating adults with plaque psoriasis only when: | 1.2Secukinumab treatment should be stopped in people whose psoriasis has not responded adequately at 12 weeks. Further treatment cycles are not recommended in these people. An adequate response is defined as either: | 1.3People whose treatment with secukinumab is not recommended in this NICE guidance, but was started within the NHS before this guidance was published, should be able to continue treatment until they and their NHS clinician consider it appropriate to stop. | 1.4When using the DLQI, healthcare professionals should take into account any physical, sensory or learning disabilities, or communication difficulties, that could affect the responses to the DLQI and make any adjustments they consider appropriate.",Rejected
Cangrelor for reducing atherothrombotic events in people undergoing percutaneous coronary intervention or awaiting surgery requiring interruption of anti‑platelet therapy (terminated appraisal),Recommendation Not Found,Rejected
Omalizumab for previously treated chronic spontaneous urticaria,"1.1Omalizumab is recommended as an option as add‑on therapy for treating severe chronic spontaneous urticaria in adults and young people aged 12 years and over only if: | 1.2People whose treatment with omalizumab is not recommended in this NICE guidance, but was started within the NHS before this guidance was published, should be able to continue treatment until they and their NHS clinician consider it appropriate to stop.",Rejected
Vedolizumab for treating moderately to severely active ulcerative colitis,"1.1Vedolizumab is recommended, within its marketing authorisation, as an option for treating moderately to severely active ulcerative colitis in adults only if the company provides vedolizumab with the discount agreed in the patient access scheme. | 1.2Vedolizumab should be given until it stops working or surgery is needed. At 12 months after the start of treatment, people should be reassessed to see whether treatment should continue. Treatment should only continue if there is clear evidence of ongoing clinical benefit. For people in complete remission at 12 months, consider stopping vedolizumab, resuming treatment if there is a relapse. People who continue vedolizumab should be reassessed at least every 12 months to see whether continued treatment is justified.",Conditional
Apixaban for the treatment and secondary prevention of deep vein thrombosis and/or pulmonary embolism,"1.1Apixaban is recommended, within its marketing authorisation, as an option for treating and for preventing recurrent deep vein thrombosis and pulmonary embolism in adults.",Approved
Obinutuzumab in combination with chlorambucil for untreated chronic lymphocytic leukaemia,"1.1Obinutuzumab, in combination with chlorambucil, is recommended as an option for adults with untreated chronic lymphocytic leukaemia who have comorbidities that make full‑dose fludarabine‑based therapy unsuitable for them, only if: | 1.2People whose treatment with obinutuzumab is not recommended in this NICE guidance, but was started within the NHS before this guidance was published, should be able to continue treatment until they and their NHS clinician consider it appropriate to stop.",Rejected
Rivaroxaban for preventing adverse outcomes after acute management of acute coronary syndrome,"Rivaroxaban is recommended as an option within its marketing authorisation, in combination with aspirin plus clopidogrel or aspirin alone, for preventing atherothrombotic events in people who have had an acute coronary syndrome with elevated cardiac biomarkers. | Clinicians should carefully assess the person's risk of bleeding before treatment with rivaroxaban is started. The decision to start treatment should be made after an informed discussion between the clinician and the patient about the benefits and risks of rivaroxaban in combination with aspirin plus clopidogrel or with aspirin alone, compared with aspirin plus clopidogrel or aspirin alone. | A decision on continuation of treatment should be taken no later than 12 months after starting treatment. Clinicians should regularly reassess the relative benefits and risks of continuing treatment with rivaroxaban and discuss them with the patient.",Approved
Empagliflozin in combination therapy for treating type 2 diabetes,"1.1Empagliflozin in a dual therapy regimen in combination with metformin is recommended as an option for treating type 2 diabetes, only if: | 1.2Empagliflozin in a triple therapy regimen is recommended as an option for treating type 2 diabetes in combination with: | 1.3Empagliflozin in combination with insulin with or without other antidiabetic drugs is recommended as an option for treating type 2 diabetes. | 1.4People currently receiving treatment initiated within the NHS with empagliflozin that is not recommended for them by NICE in this guidance should be able to continue treatment until they and their NHS clinician consider it appropriate to stop.",Rejected
Rifaximin for preventing episodes of overt hepatic encephalopathy,"1.1Rifaximin is recommended, within its marketing authorisation, as an option for reducing the recurrence of episodes of overt hepatic encephalopathy in people aged 18 years or older.",Approved
"Infliximab, adalimumab and golimumab for treating moderately to severely active ulcerative colitis after the failure of conventional therapy","Infliximab, adalimumab and golimumab are recommended, within their marketing authorisations, as options for treating moderately to severely active ulcerative colitis in adults whose disease has responded inadequately to conventional therapy including corticosteroids and mercaptopurine or azathioprine, or who cannot tolerate, or have medical contraindications for, such therapies.Golimumab is recommended only if the company provides the 100 mg dose of golimumab at the same cost as the 50 mg dose, as agreed in the patient access scheme. | The choice of treatment between infliximab, adalimumab or golimumab should be made on an individual basis after discussion between the responsible clinician and the patient about the advantages and disadvantages of the treatments available. This should take into consideration therapeutic need and whether or not the patient is likely to adhere to treatment. If more than 1 treatment is suitable, the least expensive should be chosen (taking into account administration costs, dosage and price per dose). | Infliximab is recommended, within its marketing authorisation, as an option for treating severely active ulcerative colitis in children and young people aged 6 to 17 years whose disease has responded inadequately to conventional therapy including corticosteroids and mercaptopurine or azathioprine, or who cannot tolerate, or have medical contraindications for, such therapies. | Infliximab, adalimumab or golimumab should be given as a planned course of treatment until treatment fails (including the need for surgery) or until 12 months after starting treatment, whichever is shorter. Specialists should then discuss the risks and benefits of continued treatment with the patient, and their parent or carer if appropriate: They should continue treatment only if there is clear evidence of response as determined by clinical symptoms, biological markers and investigation, including endoscopy if necessary. People who continue treatment should be reassessed at least every 12 months to determine whether ongoing treatment is still clinically appropriate. They should consider a trial withdrawal from treatment for all patients who are in stable clinical remission. People whose disease relapses after treatment is stopped should have the option to start treatment again.",Conditional
Sofosbuvir for treating chronic hepatitis C,"1.1Sofosbuvir is recommended as an option for treating chronic hepatitis C in adults, as specified in table 1. | 1.2People currently receiving treatment initiated within the NHS with sofosbuvir that is not recommended for them by NICE in this guidance should be able to continue treatment until they and their NHS clinician consider it appropriate to stop.",Rejected
Axitinib for treating advanced renal cell carcinoma after failure of prior systemic treatment,"Axitinib is recommended as an option for treating adults with advanced renal cell carcinoma after failure of treatment with a first‑line tyrosine kinase inhibitor or a cytokine, only if the company provides axitinib with the discount agreed in the patient access scheme. | At the time of publication (February 2015), axitinib has a UK marketing authorisation only for use after failure with first‑line sunitinib or a cytokine. If it is considered for use after any other first‑line treatments, the prescriber should obtain and document informed consent and follow the relevant guidance published by the General Medical Council (see the General Medical Council'sPrescribing unlicensed medicines). | Because the remit referred to NICE by the Department of Health for this technology appraisal only includes adults who have been previously treated with sunitinib, the use of axitinib after treatment with other tyrosine kinase inhibitors is not subject to statutory funding.",Conditional
Regorafenib for metastatic colorectal cancer after treatment for metastatic disease (terminated appraisal),Recommendation Not Found,Rejected
Vemurafenib for treating locally advanced or metastatic BRAF V600 mutation‑positive malignant melanoma,1.1Vemurafenib is recommended as an option for treating BRAF V600 mutation‑positive unresectable or metastatic melanoma only if the manufacturer provides vemurafenib with the discount agreed in the patient access scheme.,Conditional
Dabigatran etexilate for the treatment and secondary prevention of deep vein thrombosis and/or pulmonary embolism,"Dabigatran etexilate is recommended, within its marketing authorisation, as an option for treating and for preventing recurrent deep vein thrombosis and pulmonary embolism in adults.",Approved
Erythropoiesis‑stimulating agents (epoetin and darbepoetin) for treating anaemia in people with cancer having chemotherapy,"1.1Erythropoiesis‑stimulating agents (epoetin alfa, beta, theta and zeta, and darbepoetin alfa) are recommended, within their marketing authorisations, as options for treating anaemia in people with cancer who are having chemotherapy. | 1.2If different erythropoiesis‑stimulating agents are equally suitable, the product with the lowest acquisition cost for the course of treatment should be used.",Rejected
Dual‑chamber pacemakers for symptomatic bradycardia due to sick sinus syndrome without atrioventricular block,1.1Dual‑chamber pacemakers are recommended as an option for treating symptomatic bradycardia due to sick sinus syndrome without atrioventricular block.,Rejected
Nalmefene for reducing alcohol consumption in people with alcohol dependence,"1.1Nalmefene is recommended within its marketing authorisation, as an option for reducing alcohol consumption, for people with alcohol dependence:",Approved
Imatinib for the adjuvant treatment of gastrointestinal stromal tumours,"1.1Imatinib is recommended as an option as adjuvant treatment for up to 3 years for adults who are at high risk of relapse after surgery for KIT (CD117)‑positive gastrointestinal stromal tumours, as defined by the Miettinen 2006 criteria[1](based on tumour size, location and mitotic rate). | 1.2People currently receiving treatment initiated within the NHS with imatinib that is not recommended for them by NICE in this guidance should be able to continue treatment until they and their NHS clinician consider it appropriate to stop.",Rejected
Dual‑chamber pacemakers for symptomatic bradycardia due to sick sinus syndrome and/or atrioventricular block,"1.1Dual-chamber pacing is recommended for the management of symptomatic bradycardia due to sick sinus syndrome, atrioventricular block, or a combination of sick sinus syndrome and atrioventricular block, except:",Approved
Dabrafenib for treating unresectable or metastatic BRAF V600 mutation‑positive melanoma,"Dabrafenib is recommended, within its marketing authorisation, as an option for treating unresectable or metastatic BRAF V600 mutation‑positive melanoma only if the company provides dabrafenib with the discount agreed in the patient access scheme.",Conditional
