Title,Recommendation text,Decision
"Abrocitinib, tralokinumab or upadacitinib for treating moderate to severe atopic dermatitis","1.1Abrocitinib and upadacitinib are recommended as options for treating moderate to severe atopic dermatitis that is suitable for systemic treatment in adults and young people 12 years and over, only if: | 1.2Tralokinumab is recommended as an option for treating moderate to severe atopic dermatitis that is suitable for systemic treatment in adults, only if: | 1.3Stopabrocitinib,upadacitinib or tralokinumab at 16 weeks if the atopic dermatitis has not responded adequately. An adequate response is: | 1.4Take into account how skin colour could affect the EASI score, and make any appropriate adjustments. | 1.5Take into account any physical, psychological, sensory or learning disabilities, or communication difficulties that could affect the responses to the DLQI, and make any appropriate adjustments. | 1.6These recommendations are not intended to affect treatment with abrocitinib, upadacitinib or tralokinumab that was started in the NHS before this guidance was published. People having treatment outside these recommendations may continue without change to the funding arrangements in place for them before this guidance was published, until they and their NHS clinician consider it appropriate to stop. In young people this decision should be made jointly by them, their clinician, and their parents or carers.",Conditional
Duvelisib for treating relapsed or refractory chronic lymphocytic leukaemia after 2 or more treatments (terminated appraisal),Recommendation Not Found,Rejected
Imlifidase for desensitisation treatment before kidney transplant in people with chronic kidney disease,"1.1Imlifidase is recommended as a desensitisation treatment option for adults who: | 1.2This recommendation is not intended to affect treatment with imlifidase that was started in the NHS before this guidance was published. People having treatment outside this recommendation may continue without change to the funding arrangements in place for them before this guidance was published, until they and their NHS clinician consider it appropriate to stop.",Approved
"Abemaciclib with endocrine therapy for adjuvant treatment of hormone receptor-positive, HER2-negative, node-positive early breast cancer at high risk of recurrence","1.1Abemaciclib with endocrine therapy is recommended, within its marketing authorisation, as an option for adjuvant treatment of hormone receptor-positive, HER2-negative, node‑positive early breast cancer in adults whose disease is at high risk of recurrence, defined by the following clinical and pathological features:",Approved
Risankizumab for treating active psoriatic arthritis after inadequate response to DMARDs,"1.1Risankizumab, alone or with methotrexate, is recommended as an option for treating active psoriatic arthritis in adults whose disease has not responded well enough to disease-modifying antirheumatic drugs (DMARDs) or who cannot tolerate them. It is recommended only if they have: | 1.2Assess the response to risankizumab from 16 weeks. Stop risankizumab if psoriatic arthritis has not responded adequately using the Psoriatic Arthritis Response Criteria (PsARC; an adequate response is an improvement in at least 2 of the 4 criteria, 1 of which must be joint tenderness or swelling score, with no worsening in any of the 4 criteria). If PsARC response does not support continuing treatment but there is a PASI 75 response, a dermatologist should decide whether continuing treatment is appropriate based on skin response. | 1.3If risankizumab is one of a range of suitable treatments, including guselkumab, choose the least expensive (taking into account administration costs, dosage, price per dose and commercial arrangements). | 1.4Take into account any physical, sensory or learning disabilities, or communication difficulties that could affect the responses to the PsARC, and make any adjustments needed. | 1.5Take into account how skin colour could affect the PASI score and make any adjustments needed. | 1.6These recommendations are not intended to affect treatment with risankizumab that was started in the NHS before this guidance was published. People having treatment outside these recommendations may continue without change to the funding arrangements in place for them before this guidance was published, until they and their NHS clinician consider it appropriate to stop.",Conditional
Icosapent ethyl with statin therapy for reducing the risk of cardiovascular events in people with raised triglycerides,"1.1Icosapent ethyl is recommended as an option for reducing the risk of cardiovascular events in adults. It is recommended if they have a high risk of cardiovascular events and raised fasting triglycerides (1.7 mmol/litre or above) and are taking statins, but only if they have: | 1.2This recommendation is not intended to affect treatment with icosapent ethyl that was started in the NHS before this guidance was published. People having treatment outside this recommendation may continue without change to the funding arrangements in place for them before this guidance was published, until they and their NHS clinician consider it appropriate to stop.",Conditional
Belimumab for treating lupus nephritis (terminated appraisal),Recommendation Not Found,Rejected
Roxadustat for treating symptomatic anaemia in chronic kidney disease,"1.1Roxadustat is recommended as an option for treating symptomatic anaemia associated with chronic kidney disease (CKD) in adults only if: | 1.2This recommendation is not intended to affect treatment with roxadustat that was started in the NHS before this guidance was published. People having treatment outside this recommendation may continue without change to the funding arrangements in place for them before this guidance was published, until they and their NHS clinician consider it appropriate to stop.",Conditional
Fenfluramine for treating seizures associated with Dravet syndrome,"1.1Fenfluramine is recommended as an add‑on to other antiseizure medicines for treating seizures associated with Dravet syndrome in people aged 2 years and older, only if: | 1.2This recommendation is not intended to affect treatment with fenfluramine that was started in the NHS before this guidance was published. People having treatment outside this recommendation may continue without change to the funding arrangements in place for them before this guidance was published, until they and their NHS clinician consider it appropriate to stop. For children and young people, this decision should be made jointly by the clinician and the child or young person, or their parents or carers.",Conditional
Teduglutide for treating short bowel syndrome,"1.1Teduglutide is recommended, within its marketing authorisation, as an option for treating short bowel syndrome (SBS) in people 1 year and above. People's condition should be stable following a period of intestinal adaptation after surgery before having teduglutide. Teduglutide is recommended only if the company provides it according to thecommercial arrangement.",Conditional
Faricimab for treating diabetic macular oedema,"1.1Faricimab is recommended as an option for treating visual impairment due to diabetic macular oedema in adults, only if: | 1.2If patients and their clinicians consider faricimab to be 1 of a range of suitable treatments (including aflibercept and ranibizumab), choose the least expensive treatment. Take account of administration costs, dosage, price per dose and commercial arrangements. | 1.3These recommendations are not intended to affect treatment with faricimab that was started in the NHS before this guidance was published. People having treatment outside these recommendations may continue without change to the funding arrangements in place for them before this guidance was published, until they and their NHS clinician consider it appropriate to stop.",Conditional
Faricimab for treating wet age-related macular degeneration,"1.1Faricimab is recommended as an option for treating wet age-related macular degeneration in adults, only if: | 1.2If patients and their clinicians consider faricimab to be 1 of a range of suitable treatments (including aflibercept and ranibizumab), choose the least expensive treatment. Take account of administration costs, dosage, price per dose and commercial arrangements. | 1.3Only continue faricimab if an adequate response to treatment is maintained. Criteria for stopping should include persistent deterioration in visual acuity and anatomical changes in the retina. | 1.4These recommendations are not intended to affect treatment with faricimab that was started in the NHS before this guidance was published. People having treatment outside these recommendations may continue without change to the funding arrangements in place for them before this guidance was published, until they and their NHS clinician consider it appropriate to stop.",Conditional
"Pembrolizumab plus chemotherapy for untreated, triple-negative, locally recurrent unresectable or metastatic breast cancer","1.1Pembrolizumab plus chemotherapy (paclitaxel or nab‑paclitaxel) is recommended as an option for treating triple‑negative, locally recurrent unresectable or metastatic breast cancer in adults who have not had chemotherapy for metastatic disease. It is recommended only if: | 1.2This recommendation is not intended to affect treatment with pembrolizumab plus chemotherapy that was started in the NHS before this guidance was published. People having treatment outside this recommendation may continue without change to the funding arrangements in place for them before this guidance was published, until they and their NHS clinician consider it appropriate to stop.",Conditional
Cemiplimab for treating advanced cutaneous squamous cell carcinoma,"1.1Cemiplimab is recommended as an option for treating metastatic or locally advanced cutaneous squamous cell carcinoma in adults when curative surgery or curative radiotherapy is not suitable, only if:",Conditional
Durvalumab for maintenance treatment of unresectable non-small-cell lung cancer after platinum-based chemoradiation,"1.1Durvalumab is recommended as an option for treating locally advanced unresectable non-small-cell lung cancer (NSCLC) in adults whose tumours express programmed cell death ligand 1 (PD‑L1) on 1% or more of cells and whose disease has not progressed after platinum-based chemoradiation, only if:",Conditional
Venetoclax for treating chronic lymphocytic leukaemia,"1.1Venetoclax monotherapy is recommended, within its marketing authorisation, for treating chronic lymphocytic leukaemia (CLL) in adults:",Approved
Enfortumab vedotin for previously treated locally advanced or metastatic urothelial cancer (terminated appraisal),Recommendation Not Found,Rejected
Anifrolumab for treating active autoantibody-positive systemic lupus erythematosus (terminated appraisal),Recommendation Not Found,Rejected
Diroximel fumarate for treating relapsing–remitting multiple sclerosis,"1.1Diroximel fumarate is recommended as an option for treating active relapsing–remitting multiple sclerosis (normally defined as 2 clinically significant relapses in the previous 2 years) in adults, only if: | 1.2If patients and their clinicians consider diroximel fumarate to be one of a range of suitable treatments (including dimethyl fumarate), choose the least expensive treatment, taking into account administration costs, dosage, price per dose and commercial arrangements. | 1.3These recommendations are not intended to affect treatment with diroximel fumarate that was started in the NHS before this guidance was published. People having treatment outside these recommendations may continue without change to the funding arrangements in place for them before this guidance was published, until they and their NHS clinician consider it appropriate to stop.",Conditional
Ibrutinib for treating Waldenstrom’s macroglobulinaemia,"1.1Ibrutinib is not recommended, within its marketing authorisation, for treating Waldenstrom's macroglobulinaemia in adults who have had at least 1 previous therapy. | 1.2This recommendation is not intended to affect treatment with ibrutinib that was funded by the Cancer Drugs Fund before final guidance was published. If this applies, when that funding ends ibrutinib will be funded by the company until the patient and their NHS clinician consider it appropriate to stop.",Rejected
Filgotinib for treating moderately to severely active ulcerative colitis,"1.1Filgotinib is recommended, within its marketing authorisation, as an option for treating moderately to severely active ulcerative colitis in adults:",Approved
TYRX Absorbable Antibacterial Envelope for preventing infection from cardiac implantable electronic devices (terminated appraisal),Recommendation Not Found,Rejected
Romosozumab for treating severe osteoporosis,"1.1Romosozumab is recommended as an option for treating severe osteoporosis in people after menopause who are at high risk of fracture, only if: | 1.2This recommendation is not intended to affect treatment with romosozumab that was started in the NHS before this guidance was published. People having treatment outside this recommendation may continue without change to the funding arrangements in place for them before this guidance was published, until they and their NHS clinician consider it appropriate to stop.",Conditional
Tepotinib for treating advanced non-small-cell lung cancer with MET gene alterations,"1.1Tepotinib is recommended, within its marketing authorisation, as an option for treating advanced non-small-cell lung cancer (NSCLC) with METex14 skipping alterations in adults, only if the company provides tepotinib according to thecommercial arrangement.",Conditional
Avelumab for maintenance treatment of locally advanced or metastatic urothelial cancer after platinum-based chemotherapy,"Avelumab is recommended as an option for maintenance treatment of locally advanced or metastatic urothelial cancer that has not progressed after platinum-based chemotherapy in adults, only if: avelumab is stopped at 5 years of uninterrupted treatment or earlier if the disease progresses and the company provides avelumab according to the commercial arrangement. | This recommendation is not intended to affect treatment with avelumab that was started in the NHS before this guidance was published. People having treatment outside this recommendation may continue without change to the funding arrangements in place for them before this guidance was published, until they and their NHS clinician consider it appropriate to stop.",Conditional
Tucatinib with trastuzumab and capecitabine for treating HER2-positive advanced breast cancer after 2 or more anti-HER2 therapies,"1.1Tucatinib with trastuzumab and capecitabine is recommended, within its marketing authorisation, as an option for treating HER2‑positive locally advanced or metastatic breast cancer in adults after 2 or more anti‑HER2 treatment therapies, only if the company provides tucatinib according to thecommercial arrangement.",Conditional
Venetoclax with low dose cytarabine for untreated acute myeloid leukaemia when intensive chemotherapy is unsuitable,"1.1Venetoclax with low dose cytarabine is recommended as an option for untreated acute myeloid leukaemia in adults when intensive chemotherapy is unsuitable, only if: | 1.2This is not intended to affect treatment with venetoclax with low dose cytarabine that was started in the NHS before this guidance was published. People having treatment outside this recommendation may continue without change to the funding arrangements in place for them before this guidance was published, until they and their NHS clinician consider it appropriate to stop.",Conditional
"Niraparib for maintenance treatment of relapsed, platinum-sensitive ovarian, fallopian tube and peritoneal cancer","1.1Niraparib is recommended as an option for treating relapsed, platinum-sensitive high-grade serous epithelial ovarian, fallopian tube or primary peritoneal cancer that has responded to the most recent course of platinum-based chemotherapy in adults. It is recommended only if:",Conditional
Nivolumab with cabozantinib for untreated advanced renal cell carcinoma (terminated appraisal),Recommendation Not Found,Rejected
Daratumumab monotherapy for treating relapsed and refractory multiple myeloma,"1.1Daratumumab monotherapy is recommended as an option for treating relapsed and refractory multiple myeloma in adults who have had a proteasome inhibitor and an immunomodulator, and whose disease progressed on the last treatment, only if:",Conditional
Sotorasib for previously treated KRAS G12C mutation-positive advanced non-small-cell lung cancer,"1.1Sotorasib is recommended for use within the Cancer Drugs Fund as an option for treating KRAS G12C mutation-positive locally advanced or metastatic non-small-cell lung cancer in adults whose disease has progressed on, or who cannot tolerate, platinum-based chemotherapy or anti-PD-1/PD-L1 immunotherapy. It is recommended only if the conditions in themanaged access agreementfor sotorasib are followed. | 1.2This recommendation is not intended to affect treatment with sotorasib that was started in the NHS before this guidance was published. People having treatment outside this recommendation may continue without change to the funding arrangements in place for them before this guidance was published, until they and their NHS clinician consider it appropriate to stop.",Conditional
Tagraxofusp for treating blastic plasmacytoid dendritic cell neoplasm (terminated appraisal),Recommendation Not Found,Rejected
Nivolumab with ipilimumab for untreated advanced renal cell carcinoma,"1.1Nivolumab with ipilimumab is recommended, within its marketing authorisation, as an option for untreated advanced renal cell carcinoma in adults:",Approved
Dostarlimab for previously treated advanced or recurrent endometrial cancer with high microsatellite instability or mismatch repair deficiency,"1.1Dostarlimab is recommended for use within the Cancer Drugs Fund as an option for treating advanced or recurrent endometrial cancer with high microsatellite instability or mismatch repair deficiency in adults who have had platinum-based chemotherapy. It is recommended only if the conditions in themanaged access agreementare followed. | 1.2This recommendation is not intended to affect treatment with dostarlimab that was started in the NHS before this guidance was published. People having treatment outside this recommendation may continue without change to the funding arrangements in place for them before this guidance was published, until they and their NHS clinician consider it appropriate to stop.",Conditional
Lenalidomide for relapsed or refractory mantle cell lymphoma (terminated appraisal),Recommendation Not Found,Rejected
Empagliflozin for treating chronic heart failure with reduced ejection fraction,"1.1Empagliflozin is recommended as an option for treating symptomatic chronic heart failure with reduced ejection fraction in adults, only if it is used as an add-on to optimised standard care with: | 1.2Start empagliflozin for treating symptomatic heart failure with reduced ejection fraction on the advice of a heart failure specialist. Monitoring should be done by the most appropriate healthcare professional. | 1.3This recommendation is not intended to affect treatment with empagliflozin that was started in the NHS before this guidance was published. People having treatment outside these recommendations may continue without change to the funding arrangements in place for them before this guidance was published, until they and their NHS clinician consider it appropriate to stop.",Conditional
Pitolisant hydrochloride for treating excessive daytime sleepiness caused by obstructive sleep apnoea,"1.1Pitolisant hydrochloride is not recommended, within its marketing authorisation, to improve wakefulness and reduce excessive daytime sleepiness in adults with obstructive sleep apnoea whose sleepiness has not been satisfactorily treated by primary obstructive sleep apnoea therapy such as continuous positive airway pressure (CPAP), or who cannot tolerate it. | 1.2This recommendation is not intended to affect treatment with pitolisant hydrochloride that was started in the NHS before this guidance was published. People having treatment outside this recommendation may continue without change to the funding arrangements in place for them before this guidance was published, until they and their NHS clinician consider it appropriate to stop.",Rejected
Solriamfetol for treating excessive daytime sleepiness caused by obstructive sleep apnoea,"1.1Solriamfetol is not recommended, within its marketing authorisation, to improve wakefulness and reduce excessive daytime sleepiness in adults with obstructive sleep apnoea whose sleepiness has not been satisfactorily treated by primary obstructive sleep apnoea therapy, such as continuous positive airway pressure (CPAP). | 1.2This recommendation is not intended to affect treatment with solriamfetol that was started in the NHS before this guidance was published. People having treatment outside this recommendation may continue without change to the funding arrangements in place for them before this guidance was published, until they and their NHS clinician consider it appropriate to stop.",Rejected
Pegcetacoplan for treating paroxysmal nocturnal haemoglobinuria,"1.1Pegcetacoplan is recommended, within its marketing authorisation, as an option for treating paroxysmal nocturnal haemoglobinuria (PNH)in adults who have anaemia after at least 3 months of treatment with a C5 inhibitor. It is recommended only if the company provides pegcetacoplan according to thecommercial arrangement.",Conditional
Dapagliflozin for treating chronic kidney disease,"1.1Dapagliflozin is recommendedas an option for treating chronic kidney disease (CKD) in adults. It is recommended only if: | 1.2This recommendation is not intended to affect treatment with dapagliflozin that was started in the NHS before this guidance was published. People having treatment outside this recommendation may continue without change to the funding arrangements in place for them before this guidance was published, until they and their NHS clinician consider it appropriate to stop.",Conditional
Pembrolizumab for treating relapsed or refractory classical Hodgkin lymphoma after stem cell transplant or at least 2 previous therapies,"1.1Pembrolizumab is recommended as an option for treating relapsed or refractory classical Hodgkin lymphoma in people aged 3 and older. It is recommended if they have had an autologous stem cell transplant that has not worked or they have had at least 2 previous therapies and an autologous stem cell transplant is not an option, and only if:",Conditional
Pembrolizumab with carboplatin and paclitaxel for untreated metastatic squamous non-small-cell lung cancer,"1.1Pembrolizumabwith carboplatin and paclitaxel is recommended as an option for untreated metastatic squamous non-small-cell lung cancer (NSCLC) in adults, only if | 1.2This recommendation is not intended to affect treatment with pembrolizumab plus carboplatin and paclitaxel that was started in the Cancer Drugs Fund before this guidance was published. For those people, pembrolizumab plus carboplatin and paclitaxel will be funded by the company until the patient and their NHS clinician consider it appropriate to stop.",Conditional
"Daratumumab with bortezomib, melphalan and prednisone for untreated multiple myeloma (terminated appraisal)",Recommendation Not Found,Rejected
Daratumumab in combination for untreated multiple myeloma when a stem cell transplant is suitable,"1.1Daratumumab plus bortezomib, thalidomide and dexamethasone is recommended, within its marketing authorisation, as induction and consolidation treatment for untreated multiple myeloma in adults, when an autologous stem cell transplant is suitable. It is recommended only if the company provides daratumumab according to thecommercial arrangement.",Conditional
Fremanezumab for preventing migraine,"1.1Fremanezumab is recommended as an option for preventing migraine in adults, only if: | 1.2Stop fremanezumab after 12 weeks of treatment if: | 1.3These recommendations are not intended to affect treatment with fremanezumab that was started in the NHS before this guidance was published. People having treatment outside these recommendations may continue without change to the funding arrangements in place for them before this guidance was published, until they and their NHS clinician consider it appropriate to stop.",Conditional
Venetoclax with azacitidine for untreated acute myeloid leukaemia when intensive chemotherapy is unsuitable,"1.1Venetoclax with azacitidine is recommended, within its marketing authorisation, as an option for untreated acute myeloid leukaemia in adults when intensive chemotherapy is unsuitable. It is recommended only if the company provides venetoclax according to thecommercial arrangement.",Conditional
Pembrolizumab for adjuvant treatment of completely resected stage 3 melanoma,"1.1Pembrolizumab is recommended, within its marketing authorisation, as an option for theadjuvant treatment of completely resected stage 3 melanoma with lymph node involvement in adults. It is recommended only if the company provides pembrolizumab according to thecommercial arrangement.",Conditional
