Title,Recommendation text,Decision
Cochlear implants for children and adults with severe to profound deafness,"1.1Unilateral cochlear implantation is recommended as an option for people with severe to profound deafness who do not receive adequate benefit from acoustic hearing aids, as defined in 1.5.If different cochlear implant systems are considered to be equally appropriate, the least costly should be used. Assessment of cost should take into account acquisition costs, long-term reliability and the support package offered.[2009] | 1.2Simultaneous bilateral cochlear implantation is recommended as an option for the following groups of people with severe to profound deafness who do not receive adequate benefit from acoustic hearing aids, as defined in 1.5: | 1.3Sequential bilateral cochlear implantation is not recommended as an option for people with severe to profound deafness.[2009] | 1.4People who had a unilateral implant before publication of this guidance, and who fall into one of the categories described in 1.2, should have the option of an additional contralateral implant only if this is considered to provide sufficient benefit by the responsible clinician after an informed discussion with the individual person and their carers.[2009] | 1.5For the purposes of this guidance, severe to profound deafness is defined as hearing only sounds that are louder than 80 dB HL (pure-tone audiometric threshold equal to or greater than 80 dB HL) at 2 or more frequencies (500 Hz, 1,000 Hz, 2,000 Hz, 3,000 Hz and 4,000 Hz) bilaterally without acoustic hearing aids. Adequate benefit from acoustic hearing aids is defined for this guidance as: | 1.6Cochlear implantation should be considered for children and adults only after an assessment by a multidisciplinary team. As part of the assessment children and adults should also have had a valid trial of an acoustic hearing aid for at least 3 months (unless contraindicated or inappropriate).[2009] | 1.7When considering the assessment of adequacy of acoustic hearing aids, the multidisciplinary team should be mindful of the need to ensure equality of access. Tests should take into account a person's disabilities (such as physical and cognitive impairments), or linguistic or other communication difficulties, and may need to be adapted. If it is not possible to administer tests in a language in which a person is sufficiently fluent for the tests to be appropriate, other methods of assessment should be considered.[2009]",Rejected
Venetoclax with rituximab for previously treated chronic lymphocytic leukaemia,"1.1Venetoclax with rituximab is recommended, within its marketing authorisation, as an option for treating chronic lymphocytic leukaemia in adults who have had at least 1 previous therapy. It is recommended only if the company provides it according to thecommercial arrangement.",Conditional
Encorafenib with binimetinib for unresectable or metastatic BRAF V600 mutation-positive melanoma,"1.1Encorafenib with binimetinib is recommended, within its marketing authorisation, as an option for treating unresectable or metastatic BRAF V600 mutation-positive melanoma in adults. It is recommended only if the company provides encorafenib and binimetinib according to thecommercial arrangements.",Conditional
"Abemaciclib with an aromatase inhibitor for previously untreated, hormone receptor-positive, HER2-negative, locally advanced or metastatic breast cancer","1.1Abemaciclib with an aromatase inhibitor is recommended, within its marketing authorisation, as an option for treating locally advanced or metastatic, hormone receptor-positive, human epidermal growth factor receptor 2 (HER2)-negative breast cancer as first endocrine-based therapy in adults. Abemaciclib is recommended only if the company provides it according to thecommercial arrangement.",Conditional
"Bevacizumab with carboplatin, gemcitabine and paclitaxel for treating the first recurrence of platinum-sensitive advanced ovarian cancer (terminated appraisal)",Recommendation Not Found,Rejected
Regorafenib for previously treated advanced hepatocellular carcinoma,"1.1Regorafenib is recommended as an option for treating advanced unresectable hepatocellular carcinoma in adults who have had sorafenib, only if: | 1.2This recommendation is not intended to affect treatment with regorafenib that was started in the NHS before this guidance was published. People having treatment outside this recommendation may continue without change to the funding arrangements in place for them before this guidance was published, until they and their NHS clinician consider it appropriate to stop.",Conditional
Darvadstrocel for treating complex perianal fistulas in Crohn’s disease,"1.1Darvadstrocel is not recommended, within its marketing authorisation, for previously treated complex perianal fistulas in adults with non-active or mildly active luminal Crohn's disease.",Rejected
Lenvatinib for untreated advanced hepatocellular carcinoma,"1.1Lenvatinib is recommended as an option for untreated, advanced, unresectable hepatocellular carcinoma in adults, only if: | 1.2This recommendation is not intended to affect treatment with lenvatinib that was started in the NHS before this guidance was published. People having treatment outside this recommendation may continue without change to the funding arrangements in place for them before this guidance was published, until they and their NHS clinician consider it appropriate to stop.",Conditional
Liposomal cytarabine–daunorubicin for untreated acute myeloid leukaemia,"1.1Liposomal cytarabine–daunorubicin is recommended, within its marketing authorisation, as an option for untreated therapy-related acute myeloid leukaemia or acute myeloid leukaemia with myelodysplasia-related changes in adults. It is recommended only if the company provides it according to thecommercial arrangement.",Conditional
Vandetanib for treating medullary thyroid cancer,"1.1Vandetanib is not recommended, within its marketing authorisation, for treating aggressive and symptomatic medullary thyroid cancer in adults with unresectable, locally advanced or metastatic disease. | 1.2This recommendation is not intended to affect treatment with vandetanib that was started in the NHS before this guidance was published. People having treatment outside this recommendation may continue without change to the funding arrangements in place for them before this guidance was published, until they and their NHS clinician consider it appropriate to stop.",Rejected
Decitabine for untreated acute myeloid leukaemia (terminated appraisal),Recommendation Not Found,Rejected
Denosumab for preventing skeletal-related events in multiple myeloma (terminated appraisal),Recommendation Not Found,Rejected
Tofacitinib for moderately to severely active ulcerative colitis,"Tofacitinib is recommended, within its marketing authorisation, as an option for treating moderately to severely active ulcerative colitis in adults when conventional therapy or a biological agent cannot be tolerated or the disease has responded inadequately or lost response to treatment. It is recommended only if the company provides tofacitinib with the discount agreed in thecommercial arrangement.",Conditional
Padeliporfin for untreated localised prostate cancer,"1.1Padeliporfin is not recommended, within its marketing authorisation, for untreated, unilateral, low-risk prostate cancer in adults. | 1.2This recommendation is not intended to affect treatment with padeliporfin that was started in the NHS before this guidance was published. People having treatment outside this recommendation may continue without change to the funding arrangements in place for them before this guidance was published, until they and their NHS clinician consider it appropriate to stop.",Rejected
Gemtuzumab ozogamicin for untreated acute myeloid leukaemia,"1.1Gemtuzumab ozogamicin, with daunorubicin and cytarabine, is recommended as an option for untreated de novo CD33-positive acute myeloid leukaemia (AML), except acute promyelocytic leukaemia, in people 15 years and over, only if: | 1.2These recommendations are not intended to affect treatment with gemtuzumab ozogamicin that was started in the NHS before this guidance was published. People having treatment outside these recommendations may continue without change to the funding arrangements in place for them before this guidance was published, until they and their NHS clinician consider it appropriate to stop. For young people aged 15 to 17, this decision should be made jointly by the young person and their parents or carers and the clinician.",Conditional
Eltrombopag for treating chronic immune thrombocytopenia,"1.1Eltrombopag is recommended as an option for treating chronic immune thrombocytopenia in adults, only if: | 1.2These recommendations are not intended to affect treatment with eltrombopag that was started in the NHS before this guidance was published. People having treatment outside these recommendations may continue without change to the funding arrangements in place for them before this guidance was published, until they and their NHS clinician consider it appropriate to stop.",Conditional
Romiplostim for the treatment of chronic immune thrombocytopenia,"Romiplostim is recommended as an option for treating chronic immune thrombocytopenia in adults, only if: their condition is refractory to standard active treatments and rescue therapies or they have severe disease and a high risk of bleeding that needs frequent courses of rescue therapies.Romiplostim is recommended only if the company makes it available with the discount agreed in the patient access scheme. | These recommendations are not intended to affect treatment with romiplostim that was started in the NHS before this guidance was published. People having treatment outside these recommendations may continue without change to the funding arrangements in place for them before this guidance was published, until they and their NHS clinician consider it appropriate to stop.",Conditional
Dabrafenib with trametinib for adjuvant treatment of resected BRAF V600 mutation-positive melanoma,"1.1Dabrafenib with trametinib is recommended, within its marketing authorisation, as an option for the adjuvant treatment of resected stage III BRAF V600 mutation-positive melanoma in adults. It is recommended only if the company provides dabrafenib and trametinib with the discounts agreed in thecommercial arrangements.",Conditional
Tofacitinib for treating active psoriatic arthritis after inadequate response to DMARDs,"1.1Tofacitinib, with methotrexate, is recommended as an option for treating active psoriatic arthritis in adults, only if: | 1.2Assess the response to tofacitinib after 12 weeks of treatment. Only continue treatment if there is clear evidence of response, defined as an improvement in at least 2 of the 4 Psoriatic Arthritis Response Criteria (PsARC), 1 of which must be joint tenderness or swelling score, with no worsening in any of the 4 criteria. People whose disease has a Psoriasis Area and Severity Index (PASI) 75 response but whose PsARC response does not justify continuing treatment should be assessed by a dermatologist, to determine whether continuing treatment is appropriate based on skin response (as described inNICE's technology appraisal guidance on etanercept, infliximab and adalimumab for the treatment of psoriatic arthritis, recommendation 1.3). | 1.3When using the PsARC healthcare professionals should take into account any physical, sensory or learning disabilities or communication difficulties that could affect a person's responses to components of the PsARC and make any adjustments they consider appropriate. | 1.4When using the PASI, healthcare professionals should take into account skin colour and how this could affect the PASI score, and make the clinical adjustments they consider appropriate. | 1.5These recommendations are not intended to affect treatment with tofacitinib that was started in the NHS before this guidance was published. People having treatment outside these recommendations may continue without change to the funding arrangements in place for them before this guidance was published, until they and their NHS clinician consider it appropriate to stop.",Conditional
Cabozantinib for untreated advanced renal cell carcinoma,"1.1Cabozantinib is recommended, within its marketing authorisation, for adults with untreated advanced renal cell carcinoma that is intermediate‑ or poor‑risk as defined in the International Metastatic Renal Cell Carcinoma Database Consortium criteria. It is recommended only if the company provides cabozantinib according to thecommercial arrangement.",Conditional
Inotuzumab ozogamicin for treating relapsed or refractory B-cell acute lymphoblastic leukaemia,"1.1Inotuzumab ozogamicin is recommended, within its marketing authorisation, as an option for treating relapsed or refractory CD22-positive B-cell precursor acute lymphoblastic leukaemia in adults. People with relapsed or refractory Philadelphia-chromosome-positive disease should have had at least 1 tyrosine kinase inhibitor.Inotuzumab ozogamicin is recommended only if the company provides it according to thecommercial arrangement.",Conditional
Lutetium (177Lu) oxodotreotide for treating unresectable or metastatic neuroendocrine tumours,"1.1Lutetium (177Lu) oxodotreotide is recommended, within its marketing authorisation, as an option for treating unresectable or metastatic, progressive, well-differentiated (grade 1 or grade 2), somatostatin receptor-positive gastroenteropancreatic neuroendocrine tumours (NETs) in adults. It is recommended only if the company provides it according to thecommercial arrangement.",Conditional
Dinutuximab beta for treating neuroblastoma,"1.1Dinutuximab beta is recommended as an option for treating high-risk neuroblastoma in people aged 12 months and over whose disease has at least partially responded to induction chemotherapy, followed by myeloablative therapy and stem cell transplant, only if: | 1.2This recommendation is not intended to affect treatment with dinutuximab beta that was started in the NHS before this guidance was published. People having treatment outside this recommendation may continue without change to the funding arrangements in place for them before this guidance was published, until they and their NHS clinician consider it appropriate to stop. For a child or young person, this decision should be made jointly by them or their parents or carers and their clinician.",Conditional
Lenvatinib and sorafenib for treating differentiated thyroid cancer after radioactive iodine,"1.1Lenvatinib and sorafenib are recommended as options for treating progressive, locally advanced or metastatic differentiated thyroid cancer (papillary, follicular or Hürthle cell) in adults whose disease does not respond to radioactive iodine, only if: | 1.2This recommendation is not intended to affect treatment with lenvatinib or sorafenib that was started in the NHS before this guidance was published. People having treatment outside this recommendation may continue without change to the funding arrangements in place for them before this guidance was published, until they and their NHS clinician consider it appropriate to stop.",Conditional
Alectinib for untreated ALK-positive advanced non-small-cell lung cancer,"1.1Alectinib is recommended, within its marketing authorisation, as an option for untreated anaplastic lymphoma kinase (ALK)-positive advanced non-small-cell lung cancer (NSCLC) in adults. It is recommended only if the company provides alectinib according to thecommercial arrangement.",Conditional
Ixekizumab for treating active psoriatic arthritis after inadequate response to DMARDs,"1.1Ixekizumab alone, or with methotrexate, is recommended as an option for treating active psoriatic arthritis in adults, only if: | 1.2Assess the response to ixekizumab after 16 weeks of treatment. Only continue treatment if there is clear evidence of response, defined as an improvement in at least 2 of the 4 Psoriatic Arthritis Response Criteria (PsARC), 1 of which must be joint tenderness or swelling score, with no worsening in any of the 4 criteria. People whose disease has a Psoriasis Area and Severity Index (PASI) 75 response but whose PsARC response does not justify continuing treatment should be assessed by a dermatologist, to determine whether continuing treatment is appropriate based on skin response (as described inNICE's technology appraisal guidance on etanercept, infliximab and adalimumab for the treatment of psoriatic arthritis, recommendation 1.3). | 1.3When using the PsARC, healthcare professionals should take into account any physical, sensory or learning disabilities or communication difficulties that could affect a person's responses to components of the PsARC and make any adjustments they consider appropriate. | 1.4When using the PASI, healthcare professionals should take into account skin colour and how this could affect the PASI score, and make the clinical adjustments they consider appropriate. | 1.5These recommendations are not intended to affect treatment with ixekizumab that was started in the NHS before this guidance was published. People having treatment outside these recommendations may continue without change to the funding arrangements in place for them before this guidance was published, until they and their NHS clinician consider it appropriate to stop.",Conditional
Dupilumab for treating moderate to severe atopic dermatitis,"1.1Dupilumab is recommended as an option for treating moderate to severe atopic dermatitis in adults, only if: | 1.2Stop dupilumab at 16 weeks if the atopic dermatitis has not responded adequately. An adequate response is: | 1.3When using the EASI, healthcare professionals should take into account skin colour and how this could affect the EASI score, and make the clinical adjustments they consider appropriate. | 1.4When using the DLQI, healthcare professionals should take into account any physical, psychological, sensory or learning disabilities, or communication difficulties that could affect the responses to the DLQI, and make any adjustments they consider appropriate. | 1.5These recommendations are not intended to affect treatment with dupilumab that was started in the NHS before this guidance was published. People having treatment outside these recommendations may continue without change to the funding arrangements in place for them before this guidance was published, until they and their NHS clinician consider it appropriate to stop.",Conditional
Ocrelizumab for treating relapsing–remitting multiple sclerosis,"1.1Ocrelizumab is recommended as an option for treating relapsing–remitting multiple sclerosis in adults with active disease defined by clinical or imaging features, only if: | 1.2This recommendation is not intended to affect treatment with ocrelizumab that was started in the NHS before this guidance was published. People having treatment outside this recommendation may continue without change to the funding arrangements in place for them before this guidance was published, until they and their NHS clinician consider it appropriate to stop.",Conditional
Pembrolizumab for untreated PD-L1-positive metastatic non-small-cell lung cancer,"1.1Pembrolizumab is recommended as an option for untreated PD‑L1-positive metastatic non-small-cell lung cancer (NSCLC) in adults whose tumours express PD‑L1 (with at least a 50% tumour proportion score) and have no epidermal growth factor receptor- or anaplastic lymphoma kinase-positive mutations, only if:",Conditional
Nivolumab for treating locally advanced unresectable or metastatic urothelial cancer after platinum-containing chemotherapy,"1.1Nivolumab is not recommended, within its marketing authorisation, for treating locally advanced unresectable or metastatic urothelial carcinoma in adults who have had platinum-containing therapy. | 1.2This recommendation is not intended to affect treatment with nivolumab that was started in the NHS before this guidance was published. People having treatment outside this recommendation may continue without change to the funding arrangements in place for them before this guidance was published, until they and their NHS clinician consider it appropriate to stop.",Rejected
Beta interferons and glatiramer acetate for treating multiple sclerosis,"1.1Interferon beta‑1a is recommended as an option for treating multiple sclerosis, only if: | 1.2Interferon beta‑1b (Extavia) is recommended as an option for treating multiple sclerosis, only if: | 1.3Glatiramer acetate is recommended as an option for treating multiple sclerosis, only if: | 1.4Interferon beta‑1b (Betaferon) is not recommended within its marketing authorisation as an option for treating multiple sclerosis. | 1.5These recommendations are not intended to affect treatment with a beta interferon or glatiramer acetate that was started in the NHS before this guidance was published. People having treatment outside these recommendations may continue without change to the funding arrangements in place for them before this guidance was published, until they and their NHS clinician consider it appropriate to stop. For children and young people, this decision should be made jointly by them, their clinician, and their parents or carers.",Rejected
"Donepezil, galantamine, rivastigmine and memantine for the treatment of Alzheimer's disease","The 3 acetylcholinesterase (AChE) inhibitors donepezil, galantamine and rivastigmine as monotherapies are recommended as options for managing mild to moderate Alzheimer's disease under all of the conditions specified in section 1.4, and inrecommendation 1.5.5 of the NICE guideline on dementia. | Memantine monotherapy is recommended as an option for managing Alzheimer's disease for people with: moderate Alzheimer's disease who are intolerant of or have a contraindication to AChE inhibitorsor severe Alzheimer's disease.Treatment should be under the conditions specified inrecommendation 1.5.5 in the NICE guideline on dementia. | This recommendation has been updated and replaced byrecommendation 1.5.5 in the NICE guideline on dementia. | If prescribing an AChE inhibitor (donepezil, galantamine or rivastigmine), treatment should normally be started with the drug with the lowest acquisition cost (taking into account required daily dose and the price per dose once shared care has started). However, an alternative AChE inhibitor could be prescribed if it is considered appropriate when taking into account adverse event profile, expectations about adherence, medical comorbidity, possibility of drug interactions and dosing profiles. | When using assessment scales to determine the severity of Alzheimer's disease, healthcare professionals should take into account any physical, sensory or learning disabilities, or communication difficulties that could affect the results and make any adjustments they consider appropriate. Healthcare professionals should also be mindful of the need to secure equality of access to treatment for patients from different ethnic groups, in particular those from different cultural backgrounds. | When assessing the severity of Alzheimer's disease and the need for treatment, healthcare professionals should not rely solely on cognition scores in circumstances in which it would be inappropriate to do so. These include: if the cognition score is not, or is not by itself, a clinically appropriate tool for assessing the severity of that patient's dementia because of the patient's learning difficulties or other disabilities (for example, sensory impairments), linguistic or other communication difficulties or level of educationor if it is not possible to apply the tool in a language in which the patient is sufficiently fluent for it to be appropriate for assessing the severity of dementiaor if there are other similar reasons why using a cognition score, or the score alone, would be inappropriate for assessing the severity of dementia.In such cases healthcare professionals should determine the need for initiation or continuation of treatment by using another appropriate method of assessment.",Approved
Guselkumab for treating moderate to severe plaque psoriasis,"1.1Guselkumab is recommended as an option for treating plaque psoriasis in adults, only if: | 1.2Stop guselkumab treatment at 16 weeks if the psoriasis has not responded adequately. An adequate response is defined as: | 1.3When using the PASI, healthcare professionals should take into account skin colour and how this could affect the PASI score, and make the clinical adjustments they consider appropriate. | 1.4When using the DLQI, healthcare professionals should take into account any physical, psychological, sensory or learning disabilities, or communication difficulties, that could affect the responses to the DLQI and make any adjustments they consider appropriate. | 1.5If patients and their clinicians consider guselkumab to be one of a range of suitable treatments, including ixekizumab and secukinumab, the least costly (taking into account administration costs and commercial arrangements) should be chosen. | 1.6This recommendation is not intended to affect treatment with guselkumab that was started in the NHS before this guidance was published. People having treatment outside this recommendation may continue without change to the funding arrangements in place for them before this guidance was published, until they and their NHS clinician consider it appropriate to stop.",Conditional
