Title,Recommendation text,Decision
Ganaxolone for treating seizures caused by CDKL5 deficiency disorder in people 2 years and over,"Ganaxolone is not recommended, within its marketing authorisation, as an add-on treatment option for seizures caused by cyclin-dependent kinase‑like 5 (CDKL5) deficiency disorder (CDD) in children and young people aged 2 to 17 years and adults who turn 18 while on treatment. | This recommendation is not intended to affect treatment with ganaxolone that was started in the NHS before this guidance was published. People having treatment outside this recommendation may continue without change to the funding arrangements in place for them before this guidance was published, until they and their NHS healthcare professional consider it appropriate to stop. For children and young people, this decision should be made jointly by the healthcare professional and the child or young person, or their parents or carers.",Rejected
Selpercatinib for advanced thyroid cancer with RET alterations after treatment with a targeted cancer drug in people 12 years and over,"Selpercatinib is recommended as an option in people 12 years and over for treating: advanced RET fusion-positive thyroid cancer that is refractory to radioactive iodine (if radioactive iodine is appropriate), only if systemic treatment is needed after sorafenib or lenvatinib advanced RET-mutant medullary thyroid cancer, only if systemic treatment is needed after cabozantinib or vandetanib.Selpercatinib is only recommended if the company provides it according to thecommercial arrangement. | This recommendation is not intended to affect treatment with selpercatinib that was started in the NHS before this guidance was published. People having treatment outside these recommendations may continue without change to the funding arrangements in place for them before this guidance was published, until they and their NHS healthcare professional consider it appropriate to stop. For children or young people, this decision should be made jointly by the healthcare professional, the child or young person, and their parents or carers.",Conditional
Selpercatinib for advanced thyroid cancer with RET alterations untreated with a targeted cancer drug in people 12 years and over,"Selpercatinib is recommended as an option for treating: advanced RET fusion-positive thyroid cancer that is refractory to radioactive iodine (if radioactive iodine is appropriate) advanced RET-mutant medullary thyroid cancer.It is for people 12 years and over and is recommended only if: the cancer has not been treated with a targeted cancer drug, and the company provides it according to thecommercial arrangement. | This recommendation is not intended to affect treatment with selpercatinib that was started in the NHS before this guidance was published. People having treatment outside this recommendation may continue without change to the funding arrangements in place for them before this guidance was published, until they and their NHS healthcare professional consider it appropriate to stop. For children or young people, this decision should be made jointly by the healthcare professional, the child or young person, and their parents or carers.",Conditional
Olaparib for treating BRCA mutation-positive HER2-negative advanced breast cancer after chemotherapy,"Olaparib is recommended, within its marketing authorisation, as an option for treating HER2-negative locally advanced or metastatic breast cancer with germline BRCA1 or BRCA2 mutations in adults who have had: an anthracycline and a taxane as neoadjuvant or adjuvant treatment, or for metastatic disease, unless these are not suitable, and endocrine therapy if they have hormone receptor (HR)-positive breast cancer, unless this is not suitable.Olaparib is only recommended if the company provides it according to thecommercial arrangement. | If people with the condition and their healthcare professional, after discussing the advantages and disadvantages of all the options, consider olaparib to be 1 of a range of suitable treatments, the lowest cost option should be used. Administration costs, dosages, price per dose and commercial arrangements should all be taken into account.",Approved
Pembrolizumab for adjuvant treatment of resected non-small-cell lung cancer,"Pembrolizumab is recommended, within its marketing authorisation, as an option for the adjuvant treatment of non-small-cell lung cancer (NSCLC) with a high risk of recurrence after complete resection and platinum-based chemotherapy in adults. Pembrolizumab is only recommended if the company provides it according to thecommercial arrangement.",Approved
Elacestrant for treating oestrogen receptor-positive HER2-negative advanced breast cancer with an ESR1 mutation after endocrine treatment,"Elacestrant is recommended as an option for treating oestrogen receptor (ER)-positive HER2-negative locally advanced or metastatic breast cancer with an activating ESR1 mutation that has progressed after at least 1 line of endocrine treatment plus a cyclin-dependent kinase (CDK) 4 and 6 inhibitor in: women, trans men and non-binary people who have been through the menopause trans women and men.Elacestrant is recommended only if: the cancer has progressed after at least 12 months of endocrine treatment plus a CDK 4 and 6 inhibitor, and the company provides it according to thecommercial arrangement. | This recommendation is not intended to affect treatment with elacestrant that was started in the NHS before this guidance was published. People having treatment outside this recommendation may continue without change to the funding arrangements in place for them before this guidance was published, until they and their NHS healthcare professional consider it appropriate to stop.",Conditional
Vadadustat for treating symptomatic anaemia in adults having dialysis for chronic kidney disease,"Vadadustat is recommended, within its marketing authorisation, as an option for treating symptomatic anaemia caused by chronic kidney disease in adults having maintenance dialysis. Vadadustat is only recommended if the company provides it according to thecommercial arrangement. | If people with the condition and their healthcare professional consider vadadustat and erythropoiesis stimulating agents (ESAs) to be suitable treatments, after discussing the advantages and disadvantages of all the options, the least expensive should be used. Administration costs, dosages, price per dose and commercial arrangements should all be taken into account.",Approved
Niraparib with abiraterone acetate and prednisone for untreated hormone-relapsed metastatic prostate cancer (terminated appraisal),Recommendation Not Found,Rejected
Anhydrous sodium thiosulfate for preventing hearing loss caused by cisplatin chemotherapy in people 1 month to 17 years with localised solid tumours,"Anhydrous sodium thiosulfate is recommended, within its marketing authorisation, for preventing hearing loss caused by cisplatin chemotherapy in people 1 month to 17 years with localised, non-metastatic solid tumours. It is only recommended if the company provides it according to thecommercial arrangement.",Approved
Vamorolone for treating Duchenne muscular dystrophy in people 4 years and over,"Vamorolone is recommended, within its marketing authorisation, as an option for treating Duchenne muscular dystrophy (DMD) in people 4 years and over. Vamorolone is only recommended if the company provides it according to thecommercial arrangement.",Approved
Bimekizumab for treating moderate to severe hidradenitis suppurativa (terminated appraisal),Recommendation Not Found,Rejected
Andexanet alfa for reversing anticoagulation in people with intracranial haemorrhage (terminated appraisal),Recommendation Not Found,Rejected
Durvalumab with chemotherapy before surgery (neoadjuvant) then alone after surgery (adjuvant) for treating resectable non-small-cell lung cancer,"Durvalumab is recommended, within its marketing authorisation, as neoadjuvant treatment with platinum-based chemotherapy, then continued alone as adjuvant treatment, for treating non-small-cell lung cancer (NSCLC) in adults whose cancer: is resectable (tumours 4 cm or over, or node positive) and has no epidermal growth factor receptor (EGFR) mutations or anaplastic lymphoma kinase (ALK) rearrangements.Durvalumab is only recommended if the company provides it according to thecommercial arrangement.",Approved
Andexanet alfa for reversing anticoagulation from apixaban or rivaroxaban,"Andexanet alfa is recommended as an option for reversing anticoagulation from apixaban or rivaroxaban in adults with life-threatening or uncontrolled bleeding, only if: the bleed is in the gastrointestinal tract, and the company provides andexanet alfa according to thecommercial arrangement. | This recommendation has been updated and replaced byNICE's technology appraisal guidance on andexanet alfa for reversing anticoagulation in people with intracranial haemorrhage (terminated appraisal).",Conditional
Tebentafusp for treating advanced uveal melanoma,"Tebentafusp is recommended, within its marketing authorisation, for treating HLA‑A*02:01-positive unresectable or metastatic uveal melanoma in adults. Tebentafusp is only recommended if the company provides it according to thecommercial arrangement.",Approved
Tirzepatide for managing overweight and obesity,"Tirzepatide is recommended as an option for managing overweight and obesity, alongside a reduced-calorie diet and increased physical activity in adults, only if they have: an initial body mass index (BMI) of at least 35 kg/m2and at least 1 weight-related comorbidity.Use a lower BMI threshold (usually reduced by 2.5 kg/m2) for people from South Asian, Chinese, other Asian, Middle Eastern, Black African or African-Caribbean ethnic backgrounds. | If less than 5% of the initial weight has been lost after 6 months on the highest tolerated dose, decide whether to continue treatment, taking into account the benefits and risks of treatment for the person. | These recommendations are not intended to affect treatment with tirzepatide that was started in the NHS before this guidance was published. People having treatment outside these recommendations may continue without change to the funding arrangements in place for them before this guidance was published, until they and their NHS healthcare professional consider it appropriate to stop.",Conditional
Ublituximab for treating relapsing multiple sclerosis,"Ublituximab is recommended as an option for treating relapsing forms of multiple sclerosis, defined as active by clinical or imaging features in adults, only if: the multiple sclerosis is relapsing–remitting, and the company provides it according to thecommercial arrangement. | Use the least expensive option of the available treatments (including ublituximab, ocrelizumab and ofatumumab). Take account of administration costs, dosages, price per dose and commercial arrangements. If the least expensive option is unsuitable, people with the condition and their healthcare professional should discuss the advantages and disadvantages of other treatments. | This recommendation is not intended to affect treatment with ublituximab that was started in the NHS before this guidance was published. People having treatment outside this recommendation may continue without change to the funding arrangements in place for them before this guidance was published, until they and their NHS healthcare professional consider it appropriate to stop.",Conditional
Elranatamab for treating relapsed and refractory multiple myeloma after 3 or more treatments,"Elranatamab is recommended withmanaged accessas an option for treating relapsed and refractory multiple myeloma in adults, only after 3 or more lines of treatment (including an immunomodulatory drug, a proteasome inhibitor and an anti‑CD38 antibody) when the multiple myeloma has progressed on the last treatment. It is only recommended if the conditions in themanaged access agreementfor elranatamab are followed. | This recommendation is not intended to affect treatment with elranatamab that was started in the NHS before this guidance was published. People having treatment outside this recommendation may continue without change to the funding arrangements in place for them before this guidance was published, until they and their NHS healthcare professional consider it appropriate to stop.",Approved
Toripalimab with chemotherapy for untreated advanced oesophageal squamous cell cancer (terminated appraisal),Recommendation Not Found,Rejected
Crizotinib for treating ROS1-positive advanced non-small-cell lung cancer,"Crizotinib is recommended as an option for treating ROS1-positive advanced non-small-cell lung cancer in adults, only if: they have not had ROS1 inhibitors the company provides it according to thecommercial arrangement. | Use the least expensive option of the available treatments (including crizotinib and entrectinib). Take account of administration costs, dosages, price per dose and commercial arrangements. If the least expensive option is unsuitable, people with the condition and their healthcare professional should discuss the advantages and disadvantages of other treatments. | This recommendation is not intended to affect treatment with crizotinib that was started in the NHS before this guidance was published. People having treatment outside this recommendation may continue without change to the funding arrangements in place for them before this guidance was published, until they and their NHS healthcare professional consider it appropriate to stop.",Conditional
Bevacizumab gamma for treating wet age-related macular degeneration,"Bevacizumab gamma is recommended as an option for treating wet age-related macular degeneration in adults, only if: the eye has a best-corrected visual acuity between 6/12 and 6/96 there is no permanent structural damage to the central fovea the lesion size is 12 disc areas or less in greatest linear dimension there are signs of recent disease progression (for example, blood vessel growth as shown by fluorescein angiography, or recent visual acuity changes) the company provides it according to thecommercial arrangement. | Use the least expensive option of the available treatments (including bevacizumab gamma, aflibercept, faricimab and ranibizumab). Take account of administration costs, dosages, price per dose and commercial arrangements. If the least expensive option is unsuitable, people with the condition and their healthcare professional should discuss the advantages and disadvantages of other treatments. | Only continue bevacizumab gamma treatment if an adequate response is maintained. Criteria for stopping should include persistent deterioration in visual acuity and anatomical changes in the retina. | These recommendations are not intended to affect treatment with bevacizumab gamma that was started in the NHS before this guidance was published. People having treatment outside these recommendations may continue without change to the funding arrangements in place for them before this guidance was published, until they and their NHS clinician consider it appropriate to stop.",Conditional
Eplontersen for treating hereditary transthyretin-related amyloidosis,"Eplontersen is recommended, within its marketing authorisation, as an option for treating hereditary transthyretin-related amyloidosis in adults with stage 1 or stage 2 polyneuropathy. It is only recommended if the company provides eplontersen according to thecommercial arrangement. | Use the least expensive option of the available treatments (including eplontersen and vutrisiran). Take account of administration costs, dosages, price per dose and commercial arrangements. If the least expensive option is unsuitable, people with the condition and their healthcare professional should discuss the advantages and disadvantages of other treatments.",Approved
Pembrolizumab with chemotherapy before surgery (neoadjuvant) then alone after surgery (adjuvant) for treating resectable non-small-cell lung cancer,"Pembrolizumab is recommended, within its marketing authorisation, as an option for neoadjuvant treatment with platinum-based chemotherapy, then continued alone as adjuvant treatment, for resectable non-small-cell lung cancer (NSCLC) with a high risk of recurrence in adults. Pembrolizumab is only recommended if the company provides it according to thecommercial arrangement.",Approved
Fedratinib for treating disease-related splenomegaly or symptoms in myelofibrosis,"Fedratinib is recommended as an option for treating disease-related splenomegaly or symptoms of primary myelofibrosis, post-polycythaemia vera myelofibrosis or post-essential thrombocythaemia myelofibrosis. It is recommended for adults, only if: they have had ruxolitinib, and momelotinib is unsuitable, and the company provides fedratinib according to the commercial arrangement. | This recommendation is not intended to affect treatment with fedratinib that was started in the NHS before this guidance was published. People having treatment outside this recommendation may continue without change to the funding arrangements in place for them before this guidance was published, until they and their NHS healthcare professional consider it appropriate to stop.",Conditional
Crovalimab for treating paroxysmal nocturnal haemoglobinuria in people 12 years and over,"Crovalimab is recommended, within its marketing authorisation, as an option for treating paroxysmal nocturnal haemoglobinuria in people 12 years and over who weigh 40 kg or more. It is recommended for people who: have haemolysis with clinical symptoms indicating high disease activity are clinically stable after having a complement component 5 inhibitor for at least the past 6 months.Crovalimab is only recommended if the company provides it according to thecommercial arrangement. | If people with the condition and their healthcare professional consider crovalimab to be 1 of a range of suitable treatments, after discussing the advantages and disadvantages of all the options, the least expensive should be used. Administration costs, dosages, price per dose and commercial arrangements should all be taken into account.",Approved
Elafibranor for previously treated primary biliary cholangitis,"Elafibranor is recommended, within its marketing authorisation, as an option for treating primary biliary cholangitis in adults, when used: with ursodeoxycholic acid (UDCA), if the primary biliary cholangitis has not responded well enough to UDCA, or alone, if UDCA cannot be tolerated.Elafibranor is only recommended if the company provides it according to thecommercial arrangement.",Approved
Alectinib for adjuvant treatment of ALK-positive non-small-cell lung cancer,"Alectinib is recommended, within its marketing authorisation, as an option for the adjuvant treatment of stage 1B (tumours 4 cm or larger) to 3A ALK-positive non-small-cell lung cancer (NSCLC) after complete tumour resection in adults. It is only recommended if the company provides it according to thecommercial arrangement.",Approved
Teclistamab for treating relapsed and refractory multiple myeloma after 3 or more treatments,"Teclistamab is recommended as an option for treating relapsed and refractory multiple myeloma in adults, only after 3 or more lines of treatment (including an immunomodulatory drug, a proteasome inhibitor and an anti-CD38 antibody) when the myeloma has progressed on the last treatment. It is only recommended if the company provides teclistamab according to thecommercial arrangement. | This recommendation is not intended to affect treatment with teclistamab that was started in the NHS before this guidance was published. People having treatment outside this recommendation may continue without change to the funding arrangements in place for them before this guidance was published, until they and their NHS healthcare professional consider it appropriate to stop.",Approved
Avapritinib for treating advanced systemic mastocytosis,"Avapritinib is recommended, within its marketing authorisation, as an option for treating advanced systemic mastocytosis (including aggressive systemic mastocytosis, systemic mastocytosis with an associated haematological neoplasm and mast cell leukaemia) in adults. Avapritinib is only recommended if the company provides it according to thecommercial arrangement.",Approved
Danicopan with ravulizumab or eculizumab for treating paroxysmal nocturnal haemoglobinuria,"Danicopan is recommended, as an add-on to ravulizumab or eculizumab as an option for treating paroxysmal nocturnal haemoglobinuria (PNH) in adults who have residual haemolytic anaemia, only if: they have clinically significant extravascular haemolysis while on treatment with a complement component 5 inhibitor (C5 inhibitor) and the company provides it according to thecommercial arrangement. | This recommendation is not intended to affect treatment with danicopan that was started in the NHS before this guidance was published. People having treatment outside this recommendation may continue without change to the funding arrangements in place for them before this guidance was published, until they and their NHS healthcare professional consider it appropriate to stop.",Conditional
"Quizartinib for induction, consolidation and maintenance treatment of newly diagnosed FLT3-ITD-positive acute myeloid leukaemia","Quizartinib is recommended, within its marketing authorisation, as an option for newly diagnosed FLT3‑ITD‑positive acute myeloid leukaemia (AML) in adults, when used: with standard cytarabine and anthracycline chemotherapy as induction treatment, then with standard cytarabine chemotherapy as consolidation treatment, then alone as maintenance treatment.Quizartinib is only recommended if the company provides it according to thecommercial arrangement.",Approved
Belzutifan for treating tumours associated with von Hippel-Lindau disease,"Belzutifan is recommended withmanaged accessas an option for treating von Hippel-Lindau (VHL) disease in adults: who need treatment for VHL‑associated renal cell carcinomas, central nervous system hemangioblastomas or pancreatic neuroendocrine tumours, and when localised procedures are unsuitable or undesirable.It is only recommended if the conditions in themanaged access agreementfor belzutifan are followed. | This recommendation is not intended to affect treatment with belzutifan that was started in the NHS before this guidance was published. People having treatment outside this recommendation may continue without change to the funding arrangements in place for them before this guidance was published, until they and their NHS clinician consider it appropriate to stop.",Approved
Latanoprost–netarsudil for previously treated primary open-angle glaucoma or ocular hypertension,"Latanoprost–netarsudil is recommended as an option for reducing intraocular pressure (IOP) in adults with primary open-angle glaucoma or ocular hypertension when a prostaglandin analogue alone has not reduced IOP enough, only if: they have then tried a fixed-dose combination treatment and it has not reduced IOP enough, or a fixed-dose combination treatment containing beta-blockers is unsuitable. | This recommendation is not intended to affect treatment with latanoprost–netarsudil that was started in the NHS before this guidance was published. People having treatment outside this recommendation may continue without change to the funding arrangements in place for them before this guidance was published, until they and their NHS healthcare professional consider it appropriate to stop.",Conditional
Trifluridine–tipiracil with bevacizumab for treating metastatic colorectal cancer after 2 systemic treatments,"Trifluridine–tipiracil with bevacizumab is recommended, within its marketing authorisation, for treating metastatic colorectal cancer in adults who have had 2 lines of treatment (including fluoropyrimidine-, oxaliplatin- and irinotecan-based chemotherapies, antivascular endothelial growth factor or anti-epidermal growth factor receptor treatments). Trifluridine–tipiracil with bevacizumab is only recommended if the company provides trifluridine–tipiracil according to thecommercial arrangement.",Approved
"Rucaparib for maintenance treatment of relapsed platinum-sensitive ovarian, fallopian tube or peritoneal cancer","Rucaparib is recommended, within its marketing authorisation, as an option for the maintenance treatment of relapsed platinum-sensitive high-grade epithelial, ovarian, fallopian tube or primary peritoneal cancer that has completely or partially responded to platinum-based chemotherapy in adults. Rucaparib is only recommended if the company provides it according to thecommercial arrangement. | If people with the condition and their healthcare professional consider rucaparib to be 1 of a range of suitable treatments, after discussing the advantages and disadvantages of all the options, the least expensive should be used. Administration costs, dosages, price per dose and commercial arrangements should all be taken into account.",Approved
Empagliflozin for treating type 2 diabetes in people 10 to 17 years (terminated appraisal),Recommendation Not Found,Rejected
Evinacumab for treating homozygous familial hypercholesterolaemia in people 12 years and over,"Evinacumab alongside diet and other low-density lipoprotein-cholesterol (LDL‑C) lowering therapies is recommended, within its marketing authorisation, as an option for treating homozygous familial hypercholesterolaemia (HoFH) in people 12 years and over. It is only recommended if the company provides it according to thecommercial arrangement.",Approved
