pdf_file,extracted_answer
Abaloparatide_for_treating_osteoporosis_after_menopause.pdf,"1. Yes

2. The technology will provide impetus towards a step-change in the management of osteoporosis as it will provide an additional option in the area of bone-forming treatments. I would hope that increased options will lead to slow but steady decreases in treatment costs, enabling a wider range of higher fracture risk patients to have access to such treatments. The latter is a major unmet need in the treatment of such patients."
Galcanezumab_for_preventing_migraine.pdf,"1. Yes: It is one of the CGRP monoclonal antibodies that are the first ever migraine specific preventive treatment for migraine (both episodic and chronic) which targets the underlying biology of migraine. It offers preventative treatment with a side effect profile is better, and a dosing regimen that is far more attractive than existing treatments which will improve compliance, drop-out rates and quality of life.

2. Galcaenzumab is one of the CGRP monoclonal antibodies that is first-ever migraine-specific preventive treatment for migraine (both episodic and chronic). The treatment after an initial consultation and training is self-administered through monthly subcutaneous injection that may only need an infrequent telephone or email consultation by a specialist headache nurse. This certainly will reduce the cost of care to the patient and the hospital/primary care. The side effect profile is better than existing treatment improving compliance, drop-out rates, and quality of life. Empowering patients, improving compliance, and better side effect profile."
Roxadustat_for_treating_symptomatic_anaemia_in_chronic_kidney_disease.pdf,"1. Yes. It is the first oral preparation to treat anaemia of CKD. It has been seen to be non-inferior to current treatment ESAs in the attainment of target haemoglobin and maintenance within the desired target range. Health-related benefits would be due to a potential increase in patient compliance both due to intentional non-compliance by the patient and inadvertent non-compliance due to having to rely on family members / healthcare professionals. There would also be a potential for a lower requirement of intravenous iron. Iron is an inflammatory substance with a potential association between labile iron and oxidative stress and has potential to cause well recognized hyper-sensitivity reactions necessitating it having to be administered in a hospital setting. An oral preparation would allow an increased number of patients to have treatment initiated sooner as there would be no need to book them into actual clinic to be taught how to use it. Patients could be counselled on the medication virtually or via the telephone. Due to not requiring cold-chain storage the tablets could be posted.

2. This is an innovate technology which has developed from the Nobel Prize winning work of the Oxford group under the auspices of Sir Peter Radcliffe. This technology will add to armory in the effective management of CKD patients and in particular those who do not respond to ESA therapy. Health related benefits data is limited at present and it is difficult to comment on this and if this therapy will be better than current therapies.

Yes – novel and the more physiological approach may have longer term benefits. The combination of increasing haemoglobin with endogenous erythropoietin production and improved iron metabolism is very attractive. Certain groups may particularly benefit from this therapy.

3. HIF PHIs offer a more physiological approach to managing anaemia of CKD and initial data supports a pleiotropic effect of drugs such as Roxadustat in terms of suppressing hepcidin, improving iron utilisation and reducing the need for iron supplementation. For the patient there is likely to be less need for attendance at hospital, less medicalisation of their home with no further need for home sc EPO administration. For hospitals it will mean less patients attending for IV iron infusions which means the healthcare resource can be redirected to deal with other tasks.

4. This is an innovative technology which has developed from the Nobel prize winning work of the Oxford group under the auspices of Sir Peter Radcliffe. This technology will add to the nephrologist armory in the effective management of CKD patients and in particular those who do not respond to ESA therapy. Health related benefits data is limited at present and it is difficult to comment on this and if this therapy will be better than current therapies; is all can say is that it is as effective and safety is comparable.

Yes – novel and the more physiological approach may have longer term benefits as yet not identified including its widespread pleotropic effects which may be positive as in lipids but also negative in other areas. The combination of increasing haemoglobin with endogenous erythropoietin production and improved iron metabolism is very attractive to simplify management."
"Nivolumab_with_platinum-_and_fluoropyrimidine-based_chemotherapy_for_untreated_HER2-negative_advanced_gastric,_gastro-oesophageal_junction_or_oesophageal_adenocarcinoma.pdf","1. Yes, this is the first study to demonstrate a benefit with immunotherapy in the first line setting for gastroesophageal adenocarcinoma. Survival is prolonged by a substantial and clinically relevant amount of time. Additionally, long term survival (i.e. one and two year survival is also improved).

2. Yes. The treatment pathway will alter with respect to how long patients remain on 1st line therapy and in the ‘remission’ state due to the superior efficacy of this technology. Patients will, therefore, maintain a better HR QOL level for longer than with current treatments. This impact on health-related benefits and how it might improve the way that current need is met is substantial as the median survival for patients with CPS>=5 has improved survival beyond 12 months. This constitutes a watershed moment for this cancer and offers patients a survival outcome which is superior to a terminal prognosis."
Lenalidomide_plus_dexamethasone_for_multiple_myeloma_after_1_treatment_with_bortezomib.pdf,NULL
Nivolumab_for_adjuvant_treatment_of_resected_oesophageal_or_gastro-oesophageal_junction_cancer.pdf,"1. The technology has a favorable therapeutic window as it has demonstrated good efficacy without significant toxicity or adverse impact on quality of life. Its impact on disease-free survival (doubling of median DFS) is clinically meaningful although overall survival outcomes are awaited. Immunotherapy has been a step-change in many cancer sites and is of emerging importance in gastro-oesophageal cancer. It is a low-toxicity regimen. There are not many interventions in oesophageal cancer that have shown a HR of 0.69 with high statistical significance and doubling of disease-free survival. However, the impact on overall survival is also required. Yes, improvement in survival is a patient group with particularly poor prognosis (median disease free survival 11 months).

2. The technology has a favourable therapeutic window as it has demonstrated good efficacy without significant toxicity or adverse impact on quality of life. Its impact on disease-free survival (doubling of median DFS) is clinically meaningful although overall survival outcomes are awaited. Immunotherapy has been a step-change in many cancer sites and is of emerging importance in gastro-oesophageal cancer. It is a low-toxicity regimen. There are not many interventions in oesophageal cancer that have shown a HR of 0.69 with high statistical significance and doubling of disease-free survival. However, the impact on overall survival is also required.

3. Yes. These data clearly define a patient population who may benefit from this technology. Although the overall survival data from Checkpoint 577 is awaited; the DFS and distant metastasis-free survival curves look very encouraging with clear separation and an encouraging plateauing tail indicating the potential of long term survival at a level yet to be achieved in this patient population."
Atezolizumab_for_treating_locally_advanced_or_metastatic_non-small-cell_lung_cancer_after_chemotherapy.pdf,"1. The company considers that treatment with atezolizumab addresses a significant unmet need and represents a clinically significant innovative therapeutic option, which will provide significant positive impact on patients’ lives."
Aflibercept_for_treating_choroidal_neovascularisation.pdf,"1. Aflibercept is considered to be innovative because it is more potent than ranibizumab, potentially requiring fewer injections. This reduces the impact on patients in terms of the invasiveness of the procedure and the number of hospital visits.

2. Ranibizumab has been a significant improvement compared to PDT for myopic CNV, as the original comparator trials have shown. Whether aflibercept will be significantly better than ranibizumab is unlikely but it maybe better for some patients and would be appropriate to have as an option and both would be good to have as possibilities to switch to if the response is not as hoped. Not compared to ranibizumab but yes compared to pre –anti VEGF days of PDT or laser. No as long as ranibizumab is being offered. Maybe for a few who need many injections as this may lead to a more stable outcome, although most settle after a few injections but the condition can recur.

3. Aflibercept is innovative in that it is the only fusion protein licensed for use in retinal disease. Pre-clinical data have shown aflibercept binds VEGF many times more tightly than native receptors, and inhibits VEGF-A for twice as long as ranibizumab, but the clinical relevance of these data are uncertain. In contrast to ranibizumab, aflibercept also binds several other growth factors in addition to VEGF-A (namely, placental growth factor, VEGF-B and Galectin-1). These additional growth factors are believed to be involved in pathological neovascularisation, although their specific role and the clinical benefits of their inhibition in myopic CNV remain undefined. Current evidence does not suggest a significant efficacy benefit for aflibercept over ranibizumab in myopic CNV but it is very useful for patients and clinicians to have a choice of treatments, especially where these treatments differ in mode of action."
Elranatamab_for_treating_relapsed_and_refractory_multiple_myeloma_after_3_or_more_treatments.pdf,"1. New technology in myeloma targeting BCMA using a bispecific antibody. The results in a single arm Phase 2 study is very encouraging. Yes, new target (BCMA) and a new technology bispecific antibody with significant uplift in response rates."
Padeliporfin_for_untreated_localised_prostate_cancer.pdf,"1. Yes – it is an innovative approach to prostate cancer, and has shown a low side effect profile. It could improve the option for men with intermediate risk disease, or high volume low risk disease, offering them a cancer treatment with much fewer side effects than are seen in standard radical treatments. Yes – although it is one of a number of ways to deliver focal therapy to prostate cancer, it is particularly straightforward from a technical viewpoint meaning that the learning curve for delivering the treatment is very short, particularly for clinicians who have expertise in placing transperineal needles. In addition, access to focal therapy is not equitable across the UK with a minority of centers offering it, and many patients traveling long distances for it. Yes – to treat localized intermediate risk cancers with a low likelihood of significant reduction in urinary, sexual, and bowel function. Whilst other focal therapies seek to offer this, this technology is the only one to have been assessed in a randomized controlled trial. In addition, it has a short learning curve compared to the other two most commonly used focal therapies of high intensity focused ultrasound (HIFU) and cryotherapy.

2. Yes, for the reasons described above. Men, like all patients everywhere, want treatments that are less invasive and better tolerated."
Immunosuppressive_therapy_for_kidney_transplant_in_adults.pdf,NULL
Midostaurin_for_treating_advanced_systemic_mastocytosis.pdf,"1. Yes. This is the first licensed genetically-targeted therapeutic agent targeted against the principal driver mutation underlying SM. The SM population is particularly poorly-served by existing available medications. The population has very many unmet needs ranging across the different clinical manifestations of SM. The results of the phase 2 studies suggest superior clinical efficacy (in comparison to historical data from existing treatments such as cladribine and interferon) ranging across the different manifestations including symptom control and measures that reflect levels of abnormal mast cell infiltration (blood transfusion need, liver function, regaining lost weight, bone lesions etc.).

2. Yes – as discussed this is currently the only targeted drug with proven efficacy in patients with advanced SM. The 1-2 other treatments available are non-targeted and have significant side effects. Yes. At present the alternative cytoreductive agents are not disease modifying whereas midostaurin is. Yes – as discussed above in sections 9 & 10."
Pegylated_liposomal_irinotecan_for_treating_pancreatic_cancer_after_gemcitabine.pdf,NULL
Mepolizumab_for_treating_severe_eosinophilic_asthma.pdf,"1. Highly innovative and remarkably successful. Has largely replaced the use of regular oral corticosteroids in severe asthma. Some patients also notice an improvement in upper airway symptoms (i.e. those due to nasal polyps, a common comorbidity)."
Axicabtagene_ciloleucel_for_treating_relapsed_or_refractory_diffuse_large_B-cell_lymphoma_after_first-line_chemoimmunotherapy.pdf,"1. Yes. CAR T therapy is a revolutionary treatment which has produced impressive results in previously untreatable cancers. It represents a major innovation in cancer immunotherapy and in our ability to treat cancers without resorting to intensive chemotherapy or stem cell transplants. It is currently commissioned in 3rd line treatment setting. YES. It is already currently commissioned in 3rd line treatment setting. Yes. For transplant ineligible patients it offers the chance of improved survival and potential cure without added toxicity of high dose chemotherapy and stem cell transplant.

2. Yes. Is the technology a 'step-change' in the management of the condition? Does the use of the technology address any particular unmet need of the patient population?

3. Yes. CAR T therapy is a revolutionary treatment which has produced impressive results in previously untreatable cancers. It represents a major innovation in cancer immunotherapy and in our ability to treat cancers without resorting to intensive chemotherapy or stem cell transplants. It is currently commissioned in 3rd line treatment setting.
- YES. Intensive chemotherapy followed by autologous stem cell transplant consolidation for patients with chemo-sensitive disease was established as standard of care for relapsed DLBCL in 1995 based on a small randomised study. With addition of rituximab to 1st line chemotherapy a high proportion of patients have chemorefractory disease at relapse. This is the 1st phase 3 randomised study since 1995 to show improved outcomes for relapsed/refractory DLBCL with a new treatment compared to current SOC. CAR T therapy is already currently commissioned in 3rd line treatment setting."
"Dasatinib,_nilotinib_and_high-dose_imatinib_for_treating_imatinib-resistant_or_intolerant_chronic_myeloid_leukaemia.pdf",NULL
Tafasitamab_with_lenalidomide_for_treating_relapsed_or_refractory_diffuse_large_B-cell_lymphoma.pdf,"1. Yes, we consider the technology to be innovative in its potential to make a significant and substantial impact on health-related benefits and it will improve the way that current need is met. Patients have prolonged PFS and OS – especially if achieve CR or less prior treatments. A cohort of patients may be bridged to a curative line of therapy (CAR-T or allogeneic stem cell transplantation).

2. Yes we consider the technology to be innovative in its potential to make a significant and substantial impact on health-related benefits and it will improve the way that current need is met.

Patients have prolonged PFS and OS – especially if achieve CR or less prior treatments.

A cohort of patients may be bridged to a curative line of therapy (CAR-T or allogeneic stem cell transplantation).

Yes this is another part of a ‘step-change’ in the management of the condition."
Larotrectinib_for_treating_NTRK_fusion-positive_solid_tumours.pdf,"1. Yes. Enhances stratified approach to treatment. For tumor types in which stratified approach to therapy is not currently standard of care, yes. Less so for tumor types for which treatment (for some patients) is already based on CDx testing, although even in these conditions, NTRK-positive patients are currently treated with standard chemotherapy, so this is a step change in that sense.

2. Yes. There is a precedent for the use of genomically-targeted therapies in some rare and common cancers, however due to mutual exclusivity of “driver” mutations these therapies would not be available to patients with NTRK-positive tumors, so in that sense the technology would be a step change for this genomic subtype of cancer. Limited therapeutic options.

3. Larotrectinib is considered innovative. The technical team, company, and the NHS England and NHS Improvement National Clinical Lead for the Cancer Drugs Fund recognize the innovative potential, particularly since the adoption of larotrectinib depends on innovation and development in testing infrastructure. Despite the short follow-up and immature survival data from the trials, the company considers larotrectinib to be an innovation, likely due to its capabilities to extend life and meet the end-of-life criteria, suggesting a median progression-free survival increase compared to current treatments. Moreover, adjustments in genetic testing and treatment processing are expected to take a few years, indicating ongoing developments to enhance treatment efficacy and precision.

4. The response to the question about the technology's potential for significant health-related benefits and improvements over current needs is addressed in the first image, where the company highlights several points:

1. The company understands the histology-independent nature of larotrectinib and the rarity of NTRK gene fusion cancers present unique orthodoxy challenges to the traditional technology assessment process.
2. They believe that ""consideration of response by tumour location only serves as a distraction and introduces the potential for decision-making to be based on chance findings.""
3. The company disagrees with claims that decision-making based on tumour site effects is beneficial, asserting instead that larotrectinib has a ""large magnitude of effect irrespective of tumour site.""
4. Concerns regarding the BHM (Bayesian Hierarchical Model) methodology are mentioned, especially relating to the limited data and perceived inadequacies in the proposed statistical models.
5. It suggests that the response-based model requires surrogacy between response and survival, which the company argues is unsupported by evidence.

In summary, the company posits that the technological and methodological approach of larotrectinib challenges traditional assessment frameworks due to its broad and histology-independent efficacy, implying a significant potential to improve treatment paradigms across diverse tumour types irrespective of location.

5. The response to the question regarding the innovative potential of larotrectinib and its impact on health-related benefits as per the images can be summarized as follows:

Larotrectinib is claimed to represent a significant innovation in cancer treatment, potentially offering a paradigm shift in how cancer is managed by transitioning from tumor location to delivering treatment based on genetic identification (specifically NTRK fusions). This approach is seen as a step forward in precision medicine, capable of targeting specific biologically relevant markers across a broad range of tumor types, thereby providing an effective treatment option that can be less disruptive to patients' lives compared to traditional methods.

The company argues that larotrectinib's contribution to innovative treatment includes its ability to treat both adults and children within one indication, selectively inhibit specific kinases involved in tumor growth (TRKA, TRKB, and TRKC) without off-target effects, and its provision as an oral medication that avoids more invasive procedures affecting the patients' schooling and parenting roles.

Despite acknowledging these innovative aspects, the technical teams iteratively express concerns regarding the robustness and completeness of clinical data supporting the drug's effectiveness and cost-effectiveness, particularly for unmet needs, unrepresented tumor types, and broader end-of-life criteria. Consequently, while recognizing the potential innovation larotrectinib brings, concerns about data sufficiency and economic feasibility temper a fully supportive stance for widespread recommendation or funding approval without further evidential support."
"Olaparib_for_maintenance_treatment_of_BRCA_mutation-positive_advanced_ovarian,_fallopian_tube_or_peritoneal_cancer_after_response_to_first-line_platinum-based_chemotherapy.pdf","1. Studies show the drug has potential to significantly improve progression-free survival in patients with advanced ovarian cancer. This with the facts that the drug is used with oral administration and has relatively tolerable side effects present improvements to current practice. This is one example of targeted therapy and personalized medicine which is the current and future direction for cancer therapy. It is an additional potentially effective tool in management of recurrent disease.

2. Simple answer – yes. The improvement in survival seen with olaparib is clinically highly significant and important."
Daratumumab_with_lenalidomide_and_dexamethasone_for_untreated_multiple_myeloma_when_a_stem_cell_transplant_is_unsuitable.pdf,"1. Daratumumab is an innovative therapy which has become a key treatment in the myeloma pathway. It is available for newly diagnosed patients who are eligible for HDT-SCT. We would like to see daratumumab with this mechanism of action available for all newly diagnosed myeloma patients.

2. Yes, this is the first in class monoclonal antibody to be licenced in multiple myeloma. Its use in first line treatment induces increased depth and durability of response reducing both morbidity and overall survival in what still remains a generally incurable but increasingly chronic disease.

3. This technology is a “game changer” in terms of advancing the disease control for patients with myeloma, limiting disease-related morbidity, and improving survivorship."
Trifluridine–tipiracil_with_bevacizumab_for_treating_metastatic_colorectal_cancer_after_2_systemic_treatments.pdf,NULL
Pembrolizumab_for_adjuvant_treatment_of_completely_resected_stage_3_melanoma.pdf,"1. Melanoma is the 5th most common cancer and its incidence is related to age, however, unlike other cancers, there is a large increase in the younger working age groups (7-8 fold in the 15-24 year age group). There is a growing population of melanoma patients who are younger in age with the majority of their life ahead of them. Immunotherapies are innovative treatments that have revolutionized melanoma treatment over the last 5-10 years, initially in the metastatic setting and now in the adjuvant setting. Yes – but as mentioned - already being used via CDF. Risk of relapse from melanoma.

2. It is already standard of care. Further work is now needed to better identify who needs treatment and who does not. Yes. For years adjuvant studies had little impact on RFS. This technology has shown a clinically meaningful reduction in the risk of recurrence. Patients value time without relapse, even if the overall outcome is the same. Time spent cancer free is associated with better quality of life.

3. Yes. The improvement in RFS for pembrolizumab in stage III disease is groundbreaking. Especially when compared to marginal benefits for approved agents in similar diseases (breast cancer etc.). The relapse rate for stage 3 melanoma is high and the morbidity and mortality associated with relapse is a significant burden. This is particularly so for the younger peak in melanoma incidence in the working age population. Prior to this technology development this population only had watchful waiting/surveillance. Currently patients with stage 3 disease are treated with surgical resection and surveillance. This population has a high risk of relapse with local, regional and distant metastatic disease. Relapse is associated with the need for further treatment (surgical, SACT) and significant impact of overall survival. Reducing relapse in this population is a key unmet need. Further to this, we have had access to this technology for two years now and built up clinical experience with safe and effective delivery to address the unmet need in the community."
Sofosbuvir–velpatasvir_for_treating_chronic_hepatitis_C.pdf,NULL
Pentosan_polysulfate_sodium_for_treating_bladder_pain_syndrome.pdf,1. The condition is under recognised and under treated – I think the ability to use this more freely should improve this. Yes.
