pdf_file,extracted_answer
Cabozantinib_for_previously_treated_advanced_differentiated_thyroid_cancer_unsuitable_for_or_refractory_to_radioactive_iodine.pdf,"1. Substantial health benefits are likely to be realized based on data from the COSMIC trial which demonstrated that Cabozantinib significantly prolonged progression-free survival in patients with radio-resistant and progressive metastatic disease. Current second line treatment options for progressive (and radioresistant) DTC are limited in the UK, with patients getting best supportive care after treatment failures with drugs like Sorafenib and Levatinib.

Treatment with Cabozantinib offers a credible therapeutic option to patients in this group and the safety and efficacy of the drug have been evaluated in the COSMIC 311 Trial. Cabozantinib showed significant improvement in progression-free survival over placebo. Cabozantinib therefore is a viable therapeutic option with the potential to reduce disease burden and improve progression free survival. A drug that offers this therapeutic response in eligible patients is clearly a significant step compared to offering only best supportive care to patients with progressive metastatic radio-resistant disease.

2. Yes- currently there is no active treatment available for the majority of these patients and their prognosis is very poor, so it is addressing a significant unmet need."
Venetoclax_with_obinutuzumab_for_untreated_chronic_lymphocytic_leukaemia.pdf,"1. Treatment with Ibrutinib in relapsed patients has shown significant improvement not only in disease control, prolonging survival but also in restoring quality of life. VenO is likely to deliver similar outcome but with limited duration treatment.

2. Yes, it is likely that a significant number of the MRD negative patients are cured. For example, 51% of patients treated with Ven-Obi were in a deep molecular MRD at 10^-6 by sequencing. Yes, thanks to its tolerability and high MRD and PFS results.

3. The response area for the question 'Do you consider the technology to be innovative in its potential to make a significant and substantial impact on health-related benefits and how might it improve the way that current need is met?' from the images you provided is blank, indicating no response was recorded there."
Lanadelumab_for_preventing_recurrent_attacks_of_hereditary_angioedema.pdf,"1. The response to the question in the images is not provided within the visible text portions. The spaces for answers are blank.

2. Yes, for patients with severe or unresponsive disease. Although, the long term effects of this technology are not known and there is a need for long term post-marketing surveillance.

3. This is certainly innovative and represents the first targeted monoclonal therapy for HAE with a treatment interval of up to 4 weekly. Yes for the reasons outlined above. In patients that remain uncontrolled or are unable to take anabolic steroids this technology provides a suitable alternative that is more convenient than Cl-inhibitor concentrate which is administered 3x weekly."
Sapropterin_for_treating_hyperphenylalaninaemia_in_phenylketonuria.pdf,"1. Yes. Treatment adherence is low with dietary management in all age groups. By adulthood, it is known that 79% of adults fail to control their blood phenylalanine levels within target range even though lifelong treatment is recommended. Some patients describe moving in and out of dietary treatment but struggle to recommence dietary treatment. Probably 50% of adult patients have stopped diet completely because they are unable to adhere to it. It is unrealistic to expect patients to maintain such a restrictive diet when this is so difficult to apply on a day to day basis. Therefore for 20-30% of patients with PKU, sapropterin will offer an alternative treatment that is easy to administer and will substantially lessen the need for 'Foods for Special Purposes.’ For these patients it will ensure that they can be prescribed a treatment they are able to adhere to, maintain their blood Phe within target reference range for their age and substantially increase their natural protein tolerance.

2. Overall, the benefits expected are chiefly in reduction in the burden of the current PKU diet therapy and hence improved quality of life. For some patients these benefits might be significant, as might be the improvement in Phe control, particularly if adherence to current PKU diet is very difficult. Although there have been significant improvements in the tolerability of the standard dietary therapy, for those PKU patients who are Sapropterin responsive, this would represent the first major innovation in therapy in 50 years since dietary therapy was introduced. For some patients (& parents who are providing the diet for their children), the daily burden and complexity of the current PKU diet is high. Sapropterin would offer an alternative therapy for those that are responsive, with potential to improve Phe control and increase natural dietary protein intake (i.e. return to a more normal liberalised diet).

3. Yes – reducing the burden of diet and its impact on the family unit. May allow more social inclusiveness.

4. I agree with the submission by the NSPKU

5. No. This is just an adjunct to our current management. The simplest way to think of it is that in some patients it can reduce the baseline Phe level. No. A small number of babies with hyperphenylalaninaemia might be able to avoid dietary treatment in childhood. Only partially. Most patients will still need to maintain a low protein diet."
Trifluridine–tipiracil_for_treating_metastatic_gastric_cancer_or_gastro-oesophageal_junction_adenocarcinoma_after_2_or_more_treatments.pdf,"1. Yes, currently there is no active treatment available for patients who have progressed through 2 lines of therapy in the advanced gastric setting. This technology significantly improves survival compared to the current standard of care (BSC) and is also given orally, which is an option not available in either first or second line treatment. This is the first global study to show efficacy (survival benefit) in this indication, addressing a particular unmet need of the patient population.

2. Yes, there has not been any high quality evidence of a treatment which improved survival for patients in this setting before. Yes, it is considered a 'step-change' in the management of the condition and addresses the need for effective treatment which can improve survival."
Pembrolizumab_for_treating_relapsed_or_refractory_classical_Hodgkin_lymphoma_after_stem_cell_transplant_or_at_least_2_previous_therapies.pdf,"1. Amplification of PD-1 ligands is now known to be a defining feature of Hodgkin lymphoma. Checkpoint inhibitors have unprecedented single agent efficacy in this disease. The optimum use of PD-1 inhibitors is yet to be defined, but there is a strong pre-clinical rationale for bringing them into the treatment pathway earlier, at a point when patients are less immunosuppressed and able to mount effective anti-tumour immune responses. Yes, for transplant-unfit patients in particular.

2. PD1 inhibitors are hugely innovative and have revolutionised cancer medicine. This appraisal however is more about defining their place in the pathway. It enables a high rate of durable responses earlier on the treatment pathway, and a bridge to transplant for younger patients."
Alectinib_for_untreated_ALK-positive_advanced_non-small-cell_lung_cancer.pdf,"1. Yes. The impact on prevention and treatment of brain metastases is absolutely critical. Development and/or progression of brain metastases is a physically and psychologically devastating event which grossly affects quality of life. Any treatment that reduces the incidence of brain metastases is welcome, as is any agent that can treat existing brain metastases without the need for neurosurgery or cranial radiotherapy. On the basis of the evidence available Alectinib achieves both of these (ALEX study). Yes – the huge difference in progression free survival for patients with brain metastases treated with Alectinib compared to Crizotinib (ALEX study), is indicative of the step-change. Yes – control and prevention of brain metastases.

2. Is the technology a 'step-change' in the management of the condition?
Does the use of the technology address any particular unmet need of the patient population?

3. No. whilst it is probably an improved strategy to use alectinib up front compared to crizotinib followed by a 2nd generation ALK inhibitor such as alectinib or ceritinib this has not formally been answered within a clinical trial as yet.

The progression free survival and brain disease control seen with agent in the ALEX study suggest that it is a significant “step-up” from the present standard of care.

Yes. These patients have high rates of central nervous system metastases. Alectinib delays the onset of these metastases which can be difficult to treat.

4. Yes. The main innovation relates to CNS penetration and excellent control of intracranial disease. Additionally, it seems to have a favorable toxicity profile.

The efficacy data is a paradigm shift in the 1st line treatment of this disease and it is likely to make a substantial and significant impact on QoL. Predominantly by being less toxic, preventing the development of brain mets and delaying the progression of existing brain mets."
Sofosbuvir_for_treating_chronic_hepatitis C.pdf,NULL
Pembrolizumab_with_carboplatin_and_paclitaxel_for_untreated_metastatic_squamous_non-small-cell_lung_cancer.pdf,"1. The sections shown in the images do not provide a direct response to question 18. The answer spaces remain blank, indicating that the answers to the questions asking about the innovative potential of the technology and its impact on health-related benefits, as well as improvement of current needs, were not filled out or captured in these images."
"Alpelisib_with_fulvestrant_for_treating_hormone_receptor-positive,_HER2-negative,_PIK3CA-mutated_advanced_breast_cancer.pdf","1. Alpelisib with fulvestrant is a 'step change' as it is the only treatment to be evaluated for the PIK3CA +ve patients both after endocrine monotherapy (randomised SOLAR-1 registration trial see above) and prospectively evaluated following CDK4/6 inhibitors (ByLieve study see above). This targeted agent allows for individualised care, with a greater potential for response rather than the ‘one size fits all’ approach of chemotherapy. Other options such as Everolimus have not been evaluated in this setting and have significant pulmonary toxicity which has become a concern more recently with the Coronavirus pandemic and both the risk of contracting COVID-19 and diagnostic uncertainty.

2. Yes: because it is a targeted therapy (to PIK3CA) going beyond simply treating all patients with HR positive HER2 negative breast cancer in the same/similar manner."
Durvalumab_with_etoposide_and_either_carboplatin_or_cisplatin_for_untreated_extensive-stage_small-cell_lung_cancer.pdf,"1. Durvalumab is not innovative given that atezolizumab is already NICE approved and available for the same indication. However, durvalumab was innovative in improving overall survival over chemotherapy alone at the time the CASPIAN trial reported."
Etelcalcetide_for_treating_secondary_hyperparathyroidism.pdf,NULL
Elafibranor_for_previously_treated_primary_biliary_cholangitis.pdf,"1. Elafibranor is a new technology that has a different mode of action compared to the current second-line reimbursed treatment OCA, providing a clinically and cost-effective alternative for clinicians and patients to choose from. As described in section 3i, there are additional benefits that have not been captured within the model. Elafibranor may have a benefit on carers in reducing the burden they experience in looking after or supporting a person with PBC. Another advantage for elafibranor compared to OCA is that dose-titration is not required. OCA should be started at a dose of 5 mg once daily for the first 6 months and after this, if patients who are tolerating OCA and have not achieved an adequate reduction in ALP or TB, the dose is increased to a maximum dose of 10 mg once daily. Elafibranor’s dose is 80 mg once daily as a single tablet and no dose adjustment is required during treatment.

2. Elafibranor has a novel mode of action, though part of its activity overlaps with that of fibrates (PPAR-alpha agonists) and therefore it is innovative. The impact it will make in terms of the proportion of patients with PBC who have a durable response to treatment, which leads to a reduced liver-related mortality or the need for liver transplantation, is currently unclear.

3. No.

4. Elafibranor will, in my view, be an important addition to the therapeutic option that we have for PBC. This will, however, be an incremental advance over obeticholic acid rather than a step-change (the advent of the first second-line therapy obeticholic acid was indeed a step change). The unmet need that is addressed is a second-line therapy option for PBC patients with significant itch, where use of obeticholic acid might be regarded as undesirable, and as an alternative second-line therapy in PBC who develop significant itch with obeticholic acid that is not responsive to standard management approaches. The extent to which elafibranor will be useful as a therapy specifically for itch treatment (i.e. patients who need itch control therapy but in whom second-line therapy is not indicated; an area with limited licensed therapies but not, as far as I understand, a proposed labelled indication for elafibranor) will become clear if and when we have clinical access. With the caveat that long-term data are needed the side-effect profile and drug tolerability represent major advantages of the drug. Given the lack of significant side-effects, and the positive effect on itch, elafibranor is a net improver of PBC patient quality life. This is important in a condition where quality of life issues are frequently an important factor."
Avatrombopag_for_treating_primary_chronic_immune_thrombocytopenia.pdf,"1. Efficacy and tolerance appear similar to other TPO RAs, but there are additional benefits outlined in question 13. The relatively quick onset of action (65% had responded by day 8 in the main phase III study) compared with other TPO RA may enable clinicians to avoid steroid rescue for some patients. No, this is a drug within the class of existing TPO RA. However not all patients respond to existing TPO RA and the class of drug is particularly valuable for patients because they do not suppress the immune system. Greater patient convenience over a subcutaneous injection and no dietary restrictions. Despite their potential side effects, the HRQoL is often improved in responding patients to this class of drug (TPO RA) The published data on tolerance for avatrombopag does not appear greatly different from other treatments in this class. Advantages are convenience (oral, no dietary restriction) and potential to reduce steroid burden.

2. There are some clear advantages from a patient perspective, particularly the lack of the dietary restrictions required for eltrombopag, which can be forgotten or confused by older patients who take calcium or dairy products that reduce absorption of eltrombopag, leading to breakthrough thrombocytopenia."
Crisaborole_for_treating_mild_to_moderate_atopic_dermatitis_in_people_2_years_and_older_(terminated_appraisal).pdf,1. The technology is unlikely to be considered innovative.
Nivolumab–relatlimab_for_untreated_unresectable_or_metastatic_melanoma_in_people_12_years_and_over.pdf,"1. Yes – patients not suitable for ipilimumab and nivolumab

2. The images do not contain a response to the question on whether the technology is considered innovative in its potential to make a significant and substantial impact on health-related benefits or how it might improve the way that current need is met. The shown content only displays the question without any accompanying answer."
Mogamulizumab_for_previously_treated_mycosis_fungoides_and_Sézary_syndrome.pdf,"1. Yes, it provides a safe and effective therapy for MF/SS and will provide a new treatment option for patients who have no further lines of therapy available and are suffering painful itchy and disfiguring skin lesions.

2. Yes in that it provides evidence of benefit for the group of patients who have a particularly aggressive disease course and poor outcomes. For some patients, it may treat and stabilise their lymphoma and allow a stem cell transplant. Yes in that more effective therapies are required, in particular therapies without significant toxicities that can be continued until progression.

3. Is the technology a 'step-change' in the management of the condition? Does the use of the technology address any particular unmet need of the patient population?

4. Yes it provides a safe and effective therapy for MF/SS and will provide a new treatment option for patients who have no further lines of therapy available and are suffering painful itchy and disfiguring skin lesions."
Everolimus_with_exemestane_for_treating_advanced_breast_cancer_after_endocrine_therapy.pdf,1. The Committee acknowledged that the mechanism of action of everolimus may offer a step change in treatment by restoring sensitivity of the tumor to endocrine therapy.
Trastuzumab_emtansine_for_adjuvant_treatment_of_HER2-positive_early_breast_cancer.pdf,1. Yes
Sofosbuvir–velpatasvir–voxilaprevir_for_treating_chronic_hepatitis_C.pdf,"1. The technology addresses an unmet need in the patient population by providing treatment that is free from ribavirin, has a shorter duration, and can be deployed easily across various settings including difficult-to-access patient groups. While not considered a step-wise change in managing the condition, its innovative approach lies in its potential to achieve widespread usage with minimal side effect profile and without the need for genotype or disease staging prior to use.

2. The trial data that I have seen suggests these are more potent agents with a more pan-genotypic profile and with possibly a higher barrier to resistance than some of the current DAA drugs. Introduction of DAA therapy was a step-change. Introduction of second generation DAA drugs will improve SVR12 rates from very high to extremely high. Yes for those patients who have failed DAA containing regimens.

3. There are currently no/limited options for treating and curing those individuals that have failed DAA-based regimens. This technology would provide a significant impact and benefits in this scenario. Only for those that have failed previous DAA-based regimens. In this scenario then I consider it a 'step-change', but not in other populations."
Adalimumab_for_treating_moderate_to_severe_hidradenitis_suppurativa.pdf,NULL
Entrectinib_for_treating_ROS1-positive_advanced_non-small-cell_lung_cancer.pdf,"1. Lung cancer has become a disease of multiple molecular sub-types and there has been very clear and tangible benefits in using molecularly targeted therapies. ROS1 fusion represents 1-2% of the NSCLC (non-squamous) population and there is no doubt that targeting this molecular driver results in clear patient benefit. To date, crizotinib is the only agent available for targeting this pathway but was not designed initially as a specific ROS1 inhibitor, therefore, has less specificity for the target. Entrectinib is a multikinase inhibitor but selectively inhibits ROS/ALK/TRK and has 40x greater affinity for the ROS1 target than crizotinib. The data to date support the superior efficacy of entrectinib although it is extremely challenging to undertake a randomised controlled trial to compare the agents due to the low prevalence of the alteration and time that would be required to undertake such a study. Nonetheless, there is clear evidence for the CNS activity which could provide a step-change in the management of this condition and reduce morbidity."
Cabotegravir_with_rilpivirine_for_treating_HIV-1.pdf,"1. For a small number of patients, with specialist support, this technology has the potential to improve health-related benefits. For example, NHIVNA members were involved in initiating a patient onto injectable ART. This patient was accepted on compassionate grounds. For the first time they reached undetectable levels and the injectable ART were administered in the patient’s home each month. This has transformed the patient’s life and significantly reduced the risk of onward transmission. Potentially, for a small number of patients but not for the majority of people who adhere well to oral ART.

2. New and innovative technologies are often taken up by people who are well informed and fully engaged with a service. Although this technology may be useful for a small number of people in this group, we believe that its main potential lies in its ability to engage the small number of people with HIV in England who do not, or will not, take oral ART and have difficulty engaging with HIV services because of this.  

Investment in nursing workforce needed if widespread use of the technology is to be introduced. Use of this technology in patients with complex needs is vital, as is the specialist support to ensure this. Most people with HIV in England adhere well to oral ART and are likely to continue to do so. This technology will increase the amount and level of resources needed to deliver an HIV service. Ensuring equality and access to this technology in marginalised groups is vital."
Brentuximab_vedotin_for_treating_relapsed_or_refractory_systemic_anaplastic_large_cell_lymphoma.pdf,NULL
Sebelipase_alfa_for_treating_lysosomal_acid_lipase_deficiency_that_is_not_Wolman_disease_(terminated_appraisal).pdf,"1. LAL Deficiency is a serious, debilitating and multi-systemic disease that results in early mortality. Onset of LAL Deficiency is from birth, and affects all ages, but mainly presents as a paediatric disease. In the absence of an effective therapy, infants with this condition die before the age of 6 months. Liver failure is the main cause of death, though patients are also at risk of fatal cardiovascular events (Bernstein, 2013).

The disease represents a significant unmet medical need because there are currently no available treatment options that specifically correct the biological cause of the condition. Current therapies are supportive in nature and consist of lipid-lowering therapies, haematopoietic stem cell, and liver transplantation. These therapies do not address the underlying defect in LAL Deficiency and do not appear to substantially modify the outcome in affected patients (Hoeg, 1984; Meyers, 1985; Data on File, CSR LAL-1-NH01). Surgical interventions in particular are associated with complications and increased morbidity/mortality.

Sebelipase alfa is innovative and represents a step-change in the management of this multi-systemic, life-limiting condition because:
- It is the first pharmacological treatment approved for the treatment of LAL Deficiency.
- It is approved for use in LAL Deficiency patients of all ages.
- It is the first treatment option (pharmacological or otherwise) that addresses the underlying biological cause of LAL Deficiency. Sebelipase alfa is an ERT: therapy aims to replace deficient enzyme and prevent the damage caused by accumulation of its substrate, cholesteryl esters and triglycerides.
- Sebelipase alfa substantially improves survival in infants compared to current supportive care.
- Sebelipase alfa significantly improved markers of chronic liver injury compared to placebo, potentially reversing liver damage and improving liver outcomes in children and adults thus improving quality of life and survival.
- Sebelipase alfa significantly improved dyslipidaemia compared to placebo, supporting its role in treating the underlying cause of disease and reducing cardiovascular risk."
Lutetium-177_vipivotide_tetraxetan_for_treating_PSMA-positive_hormone-relapsed_metastatic_prostate_cancer_after_2_or_more_treatments.pdf,"1. Yes.

2. Radioligand therapy has a significant potential in changing outlook in MCRPC and hopefully in MHSPC in future. This innovative technology has increased optimism for patients in MCRPC setting who have limited options. This treatment is given every 6 weeks in comparison with Cabazitaxel chemotherapy which is delivered every 3 weeks. Given the constraints across the chemotherapy departments in the NHS, this treatment will potentially reduce the demand for chemotherapy chair and facility time as this treatment will be delivered in either the nuclear medicine units or molecular therapy units.

3. The technology is a targeted therapy and will be a game changer. It is a new mechanism of action utilizing the principle of theranostics. If available it will give an additional option of treatment for patients with PSMA positive mCRPC in a stage of disease where there is an unmet need."
"Ribociclib_with_fulvestrant_for_treating_hormone_receptor-positive,_HER2-negative_advanced_breast_cancer_after_endocrine_therapy.pdf",NULL
Trifluridine–tipiracil_for_previously_treated_metastatic_colorectal_cancer.pdf,NULL
